,제목,작가,평점,내용,장르,이용연령가,연재요일
443,물위의 우리,뱁새 / 왈패,9.98,수차례의 지각변동 이후 해수면이 급격히 상승한 지구. 딸 한별이에게 더 넓은 세상을 보여주고 싶은 호주는 한별이와 고향으로 향한다. 20년 만에 찾은 고향에는 수상한 행적들이 가득한데...과연 둘은 무사히 살아갈 수 있을까?2020 최강자전 최우수상 수상작!,"스토리, 드라마",15세 이용가,토
444,미나 이퀄,이유정,9.71,"열혈 소방관 강호는 사명감으로 모든 것을 바쳐 많은 사람들을 구해내었으나,돌아온 건, 불구가 된 몸과 처참한 죽임을 당한 아내, 세상으로부터의 배신이었다.그는 자신의 방법대로 복수를 결심하는데, 비록 자신이 구했으나, 새 삶을 살 가치가 없다 판단되는 이들의 목숨을 도로 회수하는 것. 그리곤 그 복수를 이행하기 위해 딸 '미나'를 냉혹한 킬러로 키워낸다. 시간이 흘러 10년 후,고등학생이 된 딸이 킬러로서 완성되었다 생각한 강호는지정한 타겟의 생명을 회수하라는 첫 미션을 내리는데....","스토리, 액션",18세 이용가,토
445,남편 먹는 여자,나나은,9.92,"잘생기고, 돈도 많고, 다정한 남편을 둔 성미인.그녀는 모든 여자들의 부러움을 받으며 행복한 결혼 생활을 하고 있었다.그러던 어느 날 미인은 남편의 이상한 행위를 보게 되고,그녀가 남편을 의심하면서 완벽해 보였던 결혼생활에 금이 가기 시작한다.","스토리, 드라마",15세 이용가,토
446,탑코너,윤성 / 라군,9.66,"소설가의 꿈을 가진 수학 천재소년 안시준. 우연히 광진고 축구부의 유망주 허도형과 만나게 된다. 뜻밖의 사건으로 시준에게 잠재된 축구 재능을 발견한 도형.팀을 구하기 위해 시준에게 은밀한 거래를 제안하지만.."".. 난 축구는 한 번도 해본 적 없는데..?""과연 시준은 위기에 빠진 광진고 축구부의구세주가 될 수 있을까?꿈을 좇는 소년들의 축구드라마. 수학 천재의 킥오프가 시작된다!","스토리, 스포츠",전체연령가,토
447,대충 캠퍼스로맨스임,공철진,9.96,"평범한 대학생 하윤. 갑자기 떠난 여행에서 강온을 마주친다. 강온은 하윤에게 한눈에 반하여 고백을 하지만, 하윤은 그를 거절한다. 그리고  다신 볼 일 없을 것이라 생각했던 둘은 학교 동아리 모집기간에 재회하게 되는데..! 어라? 어쩌다보니 동아리 '그대'에 같이 들어가고, 에? '그대'의 회장 지일 마저 하윤을 좋아한다고?! ㅋㅋ이거 망상 아님. 진짜임.","스토리, 로맨스",15세 이용가,토
448,왕세자 입학도,무번,9.98,"조선 후기, 성균관에 자그마한 신참이 들어온다! 모종의 이유로 정체를 숨기고 성균관 유생이 된 왕세자가 보고 겪는 체험! 민중의 현장!","스토리, 드라마",전체연령가,토
449,태백 : 튜토리얼 맨,이난 / 백세,9.94,초보스킬만 Lv.999!자아를 갖게 된 튜토리얼 NPC의 모험기!!,"스토리, 판타지",12세 이용가,토
450,디펜스 게임의 폭군이 되었다,하정 / 굥 / 류은가람,9.92,"타워디펜스&던전오펜스 RPG <제국을 지켜라>누구도 클리어하지 못한 난이도로 게임의 엔딩을 봤다.그런데 정신을 차리니 게임 속이다.그것도 공략이 불가능한 튜토리얼 스테이지다.""반드시 클리어해 주마, 이 거지 같은 게임……!""","스토리, 판타지",12세 이용가,토
451,더 해머,스튜디오M / 멘수 / P...,9.78,"마왕군 7군단장의 머리통을 최후의 일격으로 깨버린 뒤, 죽을 위기에 처한 '타이니'. 인류의 멸망을 막을 수 없는 절망적인 상황에서 유일하게 숨이 붙어있던 전우, '검제'는 가보의 힘을 이용해 타이니를 회귀시킨다.대륙 최고의 기사에서 빈민가 고아로 돌아와버린 타이니는 전생엔 없던 새로운 힘을 얻으며 강한 잠재력을 갖게 된다.이번 생은 과연, 인류의 멸망을 막을 수 있을까?","스토리, 판타지",12세 이용가,토
452,애구애구,가령,9.96,"선천적으로 한쪽 눈이 없이 태어난 강아지 ‘애구’.젖도 떼지 못하고 산골짜기에 유기된 애구는 고라니 남매 ‘고니’와 ‘라니’를 만나게 된다. '강아지 헌법 323조(?)에 의하면, 한동안 주인과 떨어져 여행을 해야 한다고?'버림받은 사실조차 모르는 순수한 애구는 함께 모험을 떠나지만, 험난한 야생과 인간들이 그들의 앞길을 가로막기 시작한다.과연 그들은 차가운 세상 속 따뜻한 보금자리를 얻을 수 있을까? 유기견과 야생 고라니의 모험 생존기!","에피소드, 드라마",전체연령가,토
453,홍시는 날 좋아해!,강하다 / 웃는해,9.97,스무 살 고3 홍시호가 전학 왔어요! 방긋방긋 웃는 모습 뒤에는 어떤 비밀이...?단내 나는 홍시가 예쁘게 여물어가는 이야기.,"에피소드, 로맨스",전체연령가,토
454,용사참수인,김세래,9.92,사형집행인으로 용사를 참수하고 은퇴하여 자유인이 된 데닐 패트릭은 한적한 산골에서 무료한 나날을 보낸다.그러던 어느 날 난데없이 딸이라고 찾아온 아이의 등장에 데닐 패트릭의 인생은 산골을 벗어나 전 대륙을 향하게 되는데...,"스토리, 판타지",15세 이용가,토
455,남편을 만렙으로 키우려 합니다,유기농 / 컬린 / 누오바,9.97,"무심한 남편 때문에 외롭게 삶을 마감한 앰버. 회귀하여 결혼 첫날밤으로 돌아온다…! 전생을 되풀이하지 않기 위해 가난한 공작가를 부흥시키고, 남편과 깔끔하게 헤어지려 하는데… ""부인이 내키시는 대로 저를 대해주십시오."" 180도 달라진 남편의 모습에 당황스럽다!","스토리, 로맨스",12세 이용가,토
456,"저무는 해, 시린 눈",MURO,9.97,태양의 신 카리야의 가호를 받은 마녀 '힐데가르'.고향을 잃은 북부인 '에르킨'은 마녀를 쫓아 이름 없는 성으로 향한다.,"스토리, 드라마",전체연령가,토
457,궤도의 아이들,나윤희 / 구김,9.86,"""누나에게서는 빛이 나는 것 같아. 너에게마저, 누나는 그런 존재일까?"" 어딜 가나 모두의 주목을 받는 남매, 류빈과 류성. 그러나 빈에게는 비밀이 있었는데, 그것은 동급생인 영인을 짝사랑하고 있다는 것. 누나인 빈에게 남모를 열등감을 품고 있던 남동생 성은, 수더분하고 조용한 소녀 영인에게 접근하기 시작한다. 어른이 되어가는 세 명의 아이들과 조금은 요란한 그들의 성장담.","스토리, 드라마",12세 이용가,토
458,엑스애쉬,김세훈 / 이광수,9.86,"[<노블레스> 이광수 X <열렙전사> 김세훈]도둑질의 천재 엑스와 수수께끼의 과거를 지닌 애쉬.기사단 제일 검, 류와 운명적인 만남으로 기사가 되기로 한다!인류 최강의 존재들만 모이는 기사단의 시험장,엑스와 애쉬는 모든 것을 가진 엘리트 귀족들과 경쟁하여 승리해야 한다!과연 그들은 기사가 될 수 있을 것인가?그리고 그 이후에 그들 앞에 펼쳐질 잔혹한 운명은…?","스토리, 판타지",12세 이용가,토
459,팬인데 왜요,요나,9.97,치열했던 삶이 어느 정도 정리가 되고 이젠 나이가 들어 무기력하게 집안에만 있던 윤순이 할머니. 이제 어떻게 살아야 할지 무엇을 해야 할지 아무것도 알지 못한 채 우울하게 하루 하루를 보내고 있던 할머니가 덕통사고를 당하게 된다.바로 잘 나가는 5인조 아이돌 그룹 라이트에게!노래를 듣고 자신의 이야기와 같다며 눈물을 흘리던 할머니는 처음에는 그들의 노래와 영상을 보기 위해 스마트폰을 샀다가 같은 라이트 팬인 초등학생 소진의 안내로 본격적인 덕질의 문을 열게 된다.덕질을 해가며 잃어버렸던 자기 자신을 되찾아가며 다양한 사람들과 만나고 새로운 일에 도전해가는 할머니의 힐링성장 이야기,"스토리, 드라마",전체연령가,토
460,이계진입 리로디드,차우민 / 쵸쵸 / 임경배,9.9,"왕의 심장이 불타 사라질 때, 현세의 운명을 초월한 존재가 이 땅에 강림하리라! 폭군을 쓰러트리고 이세계를 구원한 지구인 소년 성시한. 해피엔딩인 줄 알았건만, 그 대가는 모든 걸 빼앗기고 지구로 추방되는 것이었다. 이에 시한은 10년의 절치부심 끝에 테라노어로 되돌아오게 되는데… 한 번 세상을 구한 영웅의 이계 ‘재’진입 이야기!","스토리, 판타지",전체연령가,토
461,지옥급식,둘기마요,9.76,"힘의 논리로 지배되는 학교, 폭력에 노출된 학생과 방치하는 교사들... 그곳에 양아치를 싫어하는 전학생이 왔다!안전한 학교를 만들기 위한 전학생의 구조조정은 과연 성공할 수 있을까?","에피소드, 액션",15세 이용가,토
462,폭군 남편과 이혼하겠습니다,조사라 / 오윤하,9.88,"로판소설 속 황후에게 빙의했다. 좋은 거 아니냐고? 문제는 이 황후가 간사한 황비에게 밀려서 황제에게 박대당하고 결국 병으로 죽는 조연이라는 것이다.하지만, 원작 황후처럼 허무하게 죽을 순 없다. 폭군 남주와 이혼하기 위해서 악녀가 되어야겠다.","스토리, 로맨스",전체연령가,토
463,아사,우새새,9.95,"인간들에게 사로잡힌 마물의 왕「아사」.감옥탑에 유폐된 아사는, 태자 정진과 장군 무량 사이에 분열을 일으켜 그들의 자멸을 꾀한다. 황궁을 배경으로 펼쳐지는 정치암투와 액션, 예측불가 동양판타지.","스토리, 판타지",15세 이용가,토
464,묘령의 황자,아흐레달,9.97,"여인임을 숨기고 사내로 사는 삶을 택한 4황자 적연. 불사불멸의 신이 될 수 있는 황좌를 두고 열린 경연에 참가한다. 황자는 스무 명, 제위는 하나. 첨예한 대립 속에서 오래된 음모 하나가 서서히 베일을 벗고, 세간에 알려진 바와 달리 점점 두각을 드러내는 적연을 지켜보는 시선들이 어쩐지 짙고 깊어지는데.. 묘령의 황자를 둘러싸고 화려하게 피어나는 애증의 서사시.","스토리, 드라마",15세 이용가,토
465,공유몽,주신 / 유령선,9.92,잠이 들면 또 다른 세계가 펼쳐진다!꿈을 빼앗긴 자들이 모이는 곳 ‘큐브’고유한 능력과 아이템을 부여받은 ‘큐버’존재하지 않았던 일곱 번째 형태의 아이템을 계승한 ‘도시언’의 성장 액션 먼치킨 판타지!,"스토리, 판타지",전체연령가,토
466,완벽한 부부는 없다,롱별 / 초이 / 이다홍,9.92,"남편의 이혼 요구를 피하고 싶은 연화는 갑작스러운 사고 후 기억을 잃은 척 연기하게 되는데… 차가웠던 남편이 갑자기 달라졌다! ""원래 당신이 이렇게 다정했나요?""​","스토리, 로맨스",15세 이용가,토
467,광해의 연인,러시 / 유오디아,9.91,"“내가 그랬지, 널 기억하겠다고.”2020년 대한민국. 집안 대대로 시간 여행자라는 특별한 능력을 갖고 있는 소녀 경민.갑작스러운 아버지의 죽음에 조선시대로 타임 슬립한 그녀는 그곳에서 27살의 광해군을 만난다. 오랫동안 누군가를 애타게 찾고 그리워했던 이야기, 400년의 시간을 뛰어넘은 두 사람의 특별한 사랑이 시작된다!","스토리, 로맨스",15세 이용가,토
468,메트로헌터,두엽 / 척준경,9.78,대한민국의 수도인 서울.지하철역 곳곳에서 정체를 알 수 없는 몬스터들이 나타났다.하지만 걱정하지 마라 이 위기에서 당신을 구원해 줄해결사들이 있으니까.우리는 그들을 ‘메트로 헌터’라고 부른다!,"스토리, 판타지",전체연령가,토
469,최면학교,박은혁,9.67,"'지금부터 당신은 최면에 빠집니다...'최면능력을 가진 주인공 김찬규는 여자에게 인기를 얻고 싶어 열심히 최면을 이용해보지만 매번 뜻대로 되지 않는다. 거듭되는 실패 속에 만난 비범한 능력의 소녀와 김찬규, 특별하지만 안타까운 그들의 이야기. 이것은 개그만화가 아닙니다!","스토리, 개그",15세 이용가,토
470,마법사가 죽음을 맞이하는 방법,박젶 / 주은설,9.96,"“이제 끝내고 싶어.”사악한 드래곤을 없애야 죽을 수 있다는 저주로 인해, 300년이라는 긴 시간을 살아온 대마법사 엔테. 마침내 드래곤을 물리치고 안식을 맞이했으나 눈을 뜬 곳은 사후세계가 아닌, 휘황찬란한 귀족 저택이었다. 더군다나 마법이라곤 로맨스 판타지 소설밖에 모르는 귀족 영애의 몸에 빙의되었는데...","스토리, 판타지",12세 이용가,토
471,최강부캐,직씨,9.51,"""새로운 나를 깨워라""체감형 VR MMORPG 게임 <에르고스피어 온라인>에서 ""힐러 셔틀""을 하던 고등학생 이오름은 어느날 자신이 남몰래 키워둔 최강의 부캐 ""어벤져""가 되어버리고 만다. 그리고 연이어 나타나는 몬스터들과 각종 퀘스트들. 이오름은 모든 위기를 이겨내고 새로운 내가 될 수 있을까. 본격 부캐 활극 현대 판타지.","스토리, 액션",15세 이용가,토
472,아이돌만 하고 싶었는데,고구렁 / 와플,9.94,"생방송 무대에서 쌍코피가 거하게 터진 뒤로 폭발적인 인기를 얻게 된 <유로파>의 멤버 빛나. 앞으로 승승장구할 생각에 들떠있던 것도 잠시, 그날 이후로 자신의 몸이 달라졌음을 알게 된다. <어웨이큰>의 멤버 찬선과 함께 주변에서 일어나는 수상한 일들을 파헤치게 되고 자신들이 위험한 일에 휘말렸다는 것도 알게 된다. 하지만 이제 와서 도망칠 수도 없는 상황. 피 튀기고 혼란스러운 일상 속에서 그들은 과연 끝까지 아이돌이란 신분을 지킬 수 있을까..?","스토리, 로맨스",15세 이용가,토
473,키스 식스 센스,조코봉 / 갓녀,9.93,"키스하는 순간 미래가 보인다!키스하면 미래가 보이는 예술은 실수로 상사 차민후 팀장의 목에 키스를 한다.그 순간 예술은 미래에 차민후와 함께있는 자신의 모습을 보게 되는데……그런데 왜 하필 침대에서 뒹구는 모습인 거야?!썸은 커녕 언젠가 회사 그만 둘 때 꼭 뒷통수 한 대 후려치고 갈 생각이었는데…!어떻게든 끔찍한 미래가 현실이 되지 않게 열심히 부정해보지만이 남자, 자꾸만 나한테 다가온다!원수보다 못한 우리 사이, 진짜 로맨스가 있긴 한 거야?!아슬아슬, 화끈한 초감각 로맨스 <키스 식스 센스>.","스토리, 로맨스",15세 이용가,토
474,은둔코인,HD3,9.7,"은둔형 외톨이이자 완포세대인 청년 '구석기'. 무리하게 투자한 코인은 떡락하고, 하루하루 무의미한 삶을 보내던 어느 날. 집에 처박혀 허송세월 흘려버린 날들을 능력치로 교환할 수 있는 기적의 '은둔코인' 앱을 얻게 되는데. 과연 석기는 포기하며 살아온 것들을 다시 손에 넣을 수 있을 것인가!","스토리, 드라마",전체연령가,토
475,시선 끝 브로콜리,모차,9.96,"대인기피증을 가진 유채는 혼자가 편하다.하지만 같은 과 친구 누리의 집요함으로 원치 않는 동아리 활동을 하게 될 위기에 놓이게 된다. 하지만 자신이 꿈꾸던 완벽한 보더콜리의 탈을 쓴 건오를 만나게 되고,자신도 모르게 동아리 활동을 수락 해버린 유채.친구들에게 끌려간 회식자리에서 갑자기 주변 사람들의 모습이 다 개로 보이게 된다.뭐야 탈이 아니였어?","스토리, 드라마",전체연령가,토
476,전생연분,재아 / HAE,9.97,"'내가 후궁에게 살해당한 조선의 왕비?!'시험을 보다가 갑자기 전생을 떠올리게 된 민주.크게 당황하지만, 전생보다 중요한 것은 대입이었기에 애써 마음을 추스른다.하지만 전생의 철천지 원수였던 후궁이 민주를 찾아오고뒤이어 전생에 남편이었던 왕까지 나타나면서 민주의 수험생활은 위기를 맞는데....'전생이고 나발이고 제발 공부 좀 하자!!'","스토리, 로맨스",15세 이용가,토
477,복수를 위한 결혼동맹,EMMA / 윤희사,9.96,"황제인 남편의 음모로 죽은 론 제국의 황후 올리비아는 빈민가에 살던 이름 모를 여인의 몸으로 다시 깨어난다.그 후 도착한 곳은 결별한 전 약혼자이자, 쿠데타로 자리를 빼앗긴 '진짜' 황위 계승자 루카스의 공작 저.올리비아는 정체를 숨기고 루카스에게 제안한다. 서로의 복수를 위한 결혼 동맹을 맺자고.두 사람의 복수는 무사히 성공할 수 있을까?","스토리, 로맨스",12세 이용가,토
478,적월의 나라,박신 / 신동구,9.79,"일종의 초능력인 글리아 능력을 가진 조직원들을 동원,대통령조차 무릎 꿇게 만드는 절대 조직 ‘적월’!이 나라는 이미 ‘적월의 나라’다.악의 근원인 적월을 무너뜨릴 방법을 찾던 정부는적월 총수 신영우에 버금가는 글리아 잠재력을 지닌 류시환을 발견하고,그의 피를 이용하여 젊어지는 신약을 개발한다.그 신약으로 과거의 신영우를 궁지에 몰아넣었던 전대의 고수들,4대 악인을 전성기 시절로 되돌리는데…4대 악인은 과연 류시환의 잠재력을 끌어올려서적월을 무너뜨릴 수 있을 것인가?","스토리, 액션",15세 이용가,토
479,소년 검사,혁씨,9.72,"세계적으로 주목받는 VR 온라인 게임, '퀘스트 히어로'. 이곳의 네임드 유저인 '하랑'은 알 수 없는 검은 형체에 이끌려 다른 세계로 끌려간다. 아무리 시도해 봐도 로그아웃은 되지 않고, 설상가상으로 공격까지 당하게 되는데... '진짜'로 아픔이 느껴지는 것도 모자라, NPC 유타가 아닌 '진짜' 유타까지 만난다. 과연 하랑은 '7번의 퀘스트'를 모두 완료하고, 무사히 집으로 돌아갈 수 있을까!? 낯선 세계에 떨어진 '소년 검사' 하랑의 여정이 시작된다!","스토리, 판타지",15세 이용가,토
480,겨울특강,곤세,9.78,가난하다는 이유로 힘을 숨기고 일진들의 괴롭힘을 참아내는 고등학생 한길은아르바이트를 하고 집으로 돌아가던 길에 도깨비 방망이를 쓰는 사람들을 보게 된다.그들로부터 도깨비 방망이를 훔치는데 성공한 한길은 이제 돈 걱정 없이 살 수 있을 줄 알았지만인간의 탈을 쓴 괴물들 ‘야인’과 야인들을 사냥하는 조직 ‘꾼’들의 세계에 엮이게 된다.가진 거라곤 힘밖에 없던 소년 한길은 또다른 인생의 챕터에 들어서게 되는데...,"스토리, 판타지",15세 이용가,토
481,배달의 신,명랑 / 신얼,9.94,이승으로 쫓겨난 개념 없는 신의 아들 ‘달수’소꿉친구이자 황천에서 손맛 알아주는 셰프 ‘리사’와 함께 황천으로 돌아가기 위한 행복 맛집 배달을 시작한다!,"스토리, 드라마",전체연령가,토
482,중매쟁이 아가 황녀님,박카린 / 지미신,9.94,"피폐 소설 속 아가 황녀로 환생하게 된 주인공은,자신을 키우면서 고생하는 이모를 위해 폭군 남주인 삼촌이 있는 궁으로 들어설 결심을 한다.그런데 실제로 만난 삼촌은, 그저 애정결핍이 쪼~끔 있어보일 뿐인데..?이모도 사랑하고 삼촌도 사랑하는, 아가 황녀님의 러블리 중매 소동","스토리, 로맨스",전체연령가,토
483,왕년엔 용사님,고샤 / 솔렘,9.95,"동네 슈퍼 아줌마 '명옥'에게어딘가 낯익은 불청객이 찾아온다.""뭐?! 마왕을 봉인해달라니, 난 올해로 49살이라고!!""2019 최강자전 대상 수상작!","스토리, 판타지",전체연령가,토
484,용두사망 소설 속의 악녀가 되었다,하견 / 너구리 / 윤림,9.96,"엔딩 직전 느닷없이 제국이 멸망하는 '용두사망' 소설 속 악녀에게 빙의했다. 마계 침략으로부터 살아남기 위해 망명을 계획하지만침략의 원흉이자 마왕의 정체를 숨기고 있는 남자, 아르비스 대공이100년을 기다렸다며 애절한 고백을 털어 놓는데···. 나, 이 용두사망 소설 속에서 살아남을 수 있을까?","스토리, 로맨스",전체연령가,토
485,모두 너였다,이순기 / 오정호 / 이재익,9.96,"근 미래, 생체공학박사이자 클론 테스터 '유리'는 남편의 외도로 하루하루를 고통 속에 살고 있다.그러던 어느 날, 한달 후 폐기될 운명의 최신형 연애클론 '빅터'를 테스트하기 시작한다. 그녀는 어느샌가 빅터로부터 마음의 위안을 얻는 한편, 남편이 자신에게 저지른 끔찍한 일들을 깨닫게 되는데...!","스토리, 로맨스",12세 이용가,토
486,도사 가온,김상민,9.92,도사가 되고픈 소년 가온과 무명도사의 도술액션 모험판타지!,"스토리, 판타지",전체연령가,토
487,아가사,이다인,9.93,"‘다만 너를 사랑한 것이 나의 죄였다...’그저 사랑하는 이와의 자유로운 일생을 꿈꾸었던 왕비 '아가사'.두 눈이 가려진 채 살아온 그녀 앞에, 은밀하게 감춰져 왔던 왕국의 비밀들이 드러나게 되는데... 어둠 속 마주한 진실의 끝자락.배신과 암투, 갈망과 사랑, 인간적인 고뇌와 선택... 과연 그녀는 무너지지 않고 여명의 끝자락을 붙잡을 수 있을까.","스토리, 드라마",12세 이용가,토
488,"다비, 아찔하게 흐르는",소프트콘 / 이은비,9.97,"압록강 이북에서 찻잎을 파는 심 다점의 주인 '단이'는 한 남자의 도움으로 목숨을 건지게 된다. 목숨을 구해준 남자의 정체는 여진족이라면 가차 없이 베어버리는 냉혈인,저주받은 북방 귀신이라 불리는 조선의 장군 '서 결'.저주를 받아 물 대신 독한 차만 마실 수 있는 그는,아이들을 끌고 가 자신의 차를 끓이는 다동으로 삼고 잡아먹는다고 하는데...그런 그의 다동... 아니 다비로 거두어지게 된 단이는 북방 귀신의 집에서 무사히 지낼 수 있을까?!","스토리, 로맨스",15세 이용가,토
489,청춘일지,쏘림,9.93,지긋지긋한 재수생활을 딛고 설레는 마음으로 들어선 대학.대학에 대한 로망이 백만 가지쯤 되는 다봄은 첫날부터 빌런과 마주하게 되는데…시작부터 어딘가 삐걱! 이대로 내 캠퍼스 생활 괜찮은 걸까?!,"스토리, 로맨스",전체연령가,토
490,7FATES: CHAKHO,HYBE,8.4,"타락한 도시 신시, 길에서 마주친 수수께끼의 사내가 제하에게 의문의 말을 던진다.하지만 병원에서 깨어난 제하는 그날의 일을 기억하지 못하고...현세에 존재해선 안될 범이라는 존재들이 도시를 재앙으로 물들일 때, 일곱개의 운명이 엮어져, 그들에 맞서기 위해 무기를 든다. 이제 범을 사냥할 시간이다.","스토리, 판타지",12세 이용가,토
491,키스의 여왕,영영이 / 이재익,9.93,"누구라도 보는 순간 키스하고 싶게 만드는 여자, ‘키스의 여왕’이라는 별명을 가진 월드스타 손유리는 IT 업계의 억만장자 데이브 천과의 드라마틱한 열애 후 성대한 결혼식을 올린다.평범한 신혼여행을 거부하고 지상 최고의 허니문 여행을 떠난 그녀는 로맨틱한 첫날밤에 미친 사랑과 거대한 운명의 폭풍에 휩싸이게 되는데…“당신이 알던 그 남자는 죽었어.”","스토리, 로맨스",15세 이용가,토
492,사서고생!,몽실,9.94,"이름 안은수, 나이 23세, 대기업 고졸 정규직, 4년차 직장인.재미는 없어도 무소식이 희소식인 법. 이대로만 살면 더 바랄 게 없는 일상이었지만 주변 상황들은 그런 은수를 가만히 내버려두지 않고..사서 고생, 살아서 고생! 제대로된 어른이 되고 싶은 애어른 안은수의 청춘성장드라마!","에피소드, 드라마",전체연령가,토
493,스트릿 워크아웃,장부규,9.88,한 때는 세계 최고의 비보이라는 꿈을 좇았지만 사고로 인해 꿈과 희망을 모두 잃어버린 고등학생 백동희. 어느 날 우연히 맨몸 운동 소녀 권지니를 만나고 멈춰있던 그의 인생이 다시 움직이기 시작한다.,"스토리, 스포츠",전체연령가,토
494,밤을 깨우는 마법,외딴,9.96,해와 달이 사라져 영원한 밤에 갇힌 숲의 왕국 아르타. 마법 때문에 망한 왕국에서 하필 마법사로 태어난 루시는 도망치는 삶을 살아간다. 우연히 왕국 기사 하일에게 정체를 들키고 만 루시.이제 죽는 줄 알았는데... 되려 '공주를 구해달라'는 뜻밖의 제안을 받게 된다. 쓸모없다 여겨온 마법이 저주를 풀 열쇠가 될 수 있을까?,"스토리, 판타지",전체연령가,토
495,아침을 지나 밤으로,손지은,9.95,'사과나무의 대가로 48일간 아이를 빌려가겠습니다'기묘한 편지와 함께 사라진 동생 녹스를 찾아 헤매는 마네의 모험을 그린 정통 판타지2019년 네이버웹툰 최강자전 2위 수상작!,"스토리, 판타지",전체연령가,토
