,제목,작가,평점,내용,장르,이용연령가,연재요일
280,사기 친 공작님을 유혹해버렸다,T.Heimdallr / ...,9.9,"생계를 위해 남작 영애의 신분을 숨긴 채 길드원으로 임무를 수행하는 마리아.어느 날, 베리윈터 공작의 결혼식을 깨라는 의뢰를 받는다. ""이 결혼은 무효야! 제가... 공작님의 아이를 가졌어요!""마리아의 충격 선언에 결혼식장은 술렁이고 슬슬 퇴장하려는 찰나,""자기야, 왜 이렇게 늦었어?""베리윈터 공작이 초면에 나를 자기라고 부른다...?얼떨결에 공작의 자기가 된 마리아는 부자의 꿈을 이룰 수 있을까?","스토리, 판타지",전체연령가,목
281,수영만화일기,해오,9.9,"백수 겸 만화가지망생 해오, 저질체력에서 벗어나기 위해 수영에 도전!작심삼일이리라는 예상과는 다르게 어느새 수영에 익숙해진다.'이게 대체 어떻게 된 일이야? 나…… 수영을 사랑하게 된 걸까?'그렇게 수영을 익혀가면서 점차 몸도 마음도 성장해나가는데…….불확실한 미래를 안고 살아가지만, 해오는 오늘도 수영한다.","에피소드, 일상",전체연령가,목
282,순수한 동거생활,성은 / 플아다,9.94,"아침부터 밤까지 두근두근. 집에서도 회사에서도 꽁냥꽁냥! 오빠의 절친이자 무섭기만 하던 집주인과 같은 회사 같은 팀에 다니게 되었습니다. 동거만으로도 심장이 떨리는데, 이 남자.. 왜 나한테 잘하지? 무섭게.. 고군분투 햇병아리 사회 초년생 '오소정'과 친구의 동생을 사랑하게 된 남자 '차강우'의 옥신각신 동거 이야기.","스토리, 로맨스",12세 이용가,목
283,네가 죽기를 바랄 때가 있었다,기매 / 아란 / 진서,9.93,"끔찍하게 싫어하는 원수의 딸과 결혼하게 된 황제,절대 좋아할 수 없다 생각했던 황후에게 예상치 못한 감정을 느끼게 된다.","스토리, 로맨스",전체연령가,목
284,아인슈페너,한끼룩,9.96,"항상 남의 눈치를 살피느라 자신은 뒷전인 민다래. 어느 날 동기들에게 자신의 뒷담화를 듣고 관계의 현타가 오는데, 이 모든 게 자신의 유일한 안식처인 남자친구와 관련이 있다?","스토리, 스릴러",15세 이용가,목
285,선남친 후연애,해부기 / 정미 / 왕기대,9.91,"복학생 선배의 끈질긴 구애로 고통받던 가은은 학교 내 뜬소문으로 오해받고 있던 재림과 합의하에 쇼윈도 커플이 되기로 한다.진지한 연애는 절대 하지 않기로 했으나 재림은 예상보다 훨씬 달콤하게 다가오고, 가은은 가랑비 젖듯 재림에게 끌리고 마는데… 쿨 찾다 핫하게 엮여버린 쇼윈도 커플의 간질간질 캠퍼스 로맨스!","스토리, 로맨스",전체연령가,목
286,독거미,신진우 / 홍순식,9.69,"부패한 국가 최고 권력을 향한한 여자의 처절한 핏빛 복수가 시작된다.달콤한 신혼생활을 만끽 중인 가정주부 임나영.그러던 어느 날, 남편이 차가운 주검이 되어 돌아오고 강력계 형사였던 남편이 살해당했음을 직감한 임나영은 남편의 복수를 결심하는데...사실 평범한 주부로 비쳤던 그녀는 탈북 전 암살 및 납치 등 테러 공작을 전담하는 북한의 비밀공작원, 일명 '독거미'라 불리는 특급 킬러였다.","스토리, 드라마",15세 이용가,목
287,35cm,홍가,9.5,"초등학생 때는 반에서 키가 제일 컸지만 그 키 그대로 고등학생이 된 반하나.그리고 하나의 눈 앞에 나타난, 한참을 올려다봐야하는 훤칠한 남자애. 그 애의 정체는 바로 하나보다 작았던 한결이라고?옛날이나 지금이나 똑같은 키 차이지만, 너와 나의 입장이 뒤바뀐 35cm 거리감 이야기!","스토리, 로맨스",12세 이용가,목
288,킬더킹,마사토끼 / joana,9.68,"왕의 재능이란 무엇일까?왕좌의 새로운 주인, 진정한 왕에 걸맞는 재능을 가려내는 게임이 시작된다!","스토리, 드라마",전체연령가,목
289,위대한 겸상,홍치,9.8,어린 시절의 트라우마로 돈가스를 못 먹는 돈가스 재벌 후계자 '유은겸'과  매우 많이 먹는 앵겔지수 99%의 가난한 공시 준비생 '독고혜상'의 군침도는 먹방 로맨스.,"스토리, 로맨스",전체연령가,목
290,소녀180,나우원 / 델라,9.96,'저 남자 아닌데요...' 키 184cm 꽃미모 소녀에게 남자패션모델 제안이 들어왔다. 비밀을 가진 소년소녀들의 생기 넘치는 청춘성장물!,"스토리, 드라마",12세 이용가,목
291,가족같은 XX,서우현,9.94,"탑 배우 한나나는 우연히 갈 곳 없는 고등학생 유성우를 집에 들인다.아슬아슬한 동거가 시작된 가운데, 갑자기 좋아하던 선배 이한이 다가오기 시작하는데..?!가족 같은 남자와 가족이 되고 싶은 남자, 누가 진짜 가족이 될까?","스토리, 로맨스",15세 이용가,목
292,개와 사람의 시간,무브,9.76,"나영의 행복을 위해서라면, 무엇이든 할 수 있는 사랑스러운 반려견 우비. 그런 우비와 나영의 시간에 불현듯 개를 무서워하는 낯선 남자 영민이 들어오고, 나영과 영민의 관계가 가까워질수록 우비와 그녀의 사이는 멀어져 간다. 나영의 사랑을 독차지할 수 없게 된 우비. 결국 스스로의 한계를 느끼고 그녀의 곁을 떠나 자신을 위한 삶을 살기로 결심하게 되는데...","스토리, 드라마",전체연령가,목
293,1학년 9반,우윱,9.78,1학년 9반 친구들은 부푼 설레임을 안고 수학여행을 떠나지만. 일진들의 장난으로 반 전체가 무인도에 표류하게된다.서로에 대한 불신으로 더 이상 친구가 아닌 적이 되어 버린 1학년 9반 친구들... 과연 그들은 무사히 탈출 할 수 있을까?,"스토리, 스릴러",15세 이용가,목
294,THE 런웨이,도미 / 녹두 / Hira...,9.81,"하룻밤을 같이 보낸 그 남자가 내 상사라고?!패션지 의 에디터 유지안. 그녀는 약혼자의 양다리 소식에 무작정 파리로 떠난다.그곳에서 우연히 만난 남자와 충동적으로 하룻밤을 보내 버리고…3개월의 시간이 흐른 후, 지안의 회사에 만렙의 편집장이 프랑스에서 오게 된다. 그런데 그 남자… 바로 지안과 하룻밤을 보낸 프랑스에서의 그 남자다!!","스토리, 로맨스",15세 이용가,목
295,나의 불편한 상사,탄지 / 남은경 / 이다홍,9.77,"결혼까지 생각했던 남자친구에게 잠수이별을 당한 세라,이직 첫날 새 직장에서 남자친구의 뒤통수를 발견하고 냅다 커피를 부었는데알고 보니 생판 처음 보는 남자, 그리고 앞으로 매일 봐야 할 자신의 상사였다?일생일대 최대의 위기에 봉착한 오세라의 오피스 로맨스 코미디.","스토리, 로맨스",전체연령가,목
296,달의 요람,이정선,4.01,"낯선 나라 유안에 끌려온 멸망국의 포로, 월영.황궁에서 만난 건 가국을 멸망시킨 유안의 장군 연오와 대 유안 제국의 황제였다.궁녀에서 황귀비로, 가장 낮은 곳에서 가장 높은 곳으로거침없이 오르는 월영의 잔혹한 궁중로맨스가 시작된다.","스토리, 드라마",12세 이용가,목
297,두 번째 딸로 태어났습니다,뉴궁딩팡팡 / 용원창,9.92,"나는 첫째 딸로 태어나 5살에 죽었지만, 두 번째 삶 역시 당신의 품에서 태어났다. 내가 7살이 되었을 무렵 돌아가신 어머니. 어머니가 유품으로 남긴 종이 한 장을 챙겨 길을 나선 뒤 마주친 분홍빛 머리카락을 가진 한 남자.당신이 제 아빠라고요? 심지어 황제라고요? 오라버니도 셋이나 있어요?엄마… 나 새로운 가족들과 잘 지낼 수 있을까?","스토리, 로맨스",전체연령가,목
298,마녀의 심판은 꽃이 된다,은백 / 서현,9.96,악인에게 악취를 느끼는 선화는 난생처음 향기가 나는 정향을 만나게 된다.그러나 마냥 선한 줄만 알았던 정향은 악인을 꽃으로 만드는 마녀였는데…'혹시 죽이고 싶은 사람 있니?',"스토리, 스릴러",12세 이용가,목
299,천재의 게임방송,지금 / 하이엔드,8.95,대학교 복학을 위해 서울에 있는 누나와 함께 생활하기로한 이도현.그런데 엄친딸이던 누나가 게임 방송에 빠져버린 불속성 효녀로 변하고 말았다.방송의 재미와 도네이션에 빠진 누나에 의해 억지로 인생 첫 게임을 플레이한 도현.그런데 도현은 누구도 몰랐던 엄청난 피지컬을 선보인다.신이 내린 재능의 동생과 악마가 내린 탐욕의 누나가 함께하는 게임 방송이 시작된다!,"스토리, 액션",전체연령가,목
300,황제사냥,KAN,9.91,"지구 멸망 후 홀로 이세계로 떨어진 불멸자 '윤슬'. 모든 일의 원흉인 황제를 사냥한다!여리여리한 외모는 페이크,일단 주먹부터 나가고 보는 그녀의심장이 뜨거워지는 액션판타지!","스토리, 판타지",15세 이용가,목
301,베니루 BAENIRU,우지금,9.86,"하루하루 죽지 못해 사는 배지현. 어느 날, 어마어마한 수익을 내는 걸로 유명한 버츄얼 너튜버 ‘베니루’의 목소리가 자신의 것과 닮았다는 사실을 우연히 알게 되는데..!","스토리, 스릴러",15세 이용가,목
302,"오, 친애하는 숙적",오쏘 / 벨마 / 미나토,9.97,"눈엣가시였던 숙적을 처치하고 모든 것을 얻었다고 생각하는 순간, 회귀했다.이십년 전 자신이 후계자로 임명되기 전으로.심란해하는 칼미아 앞에 그녀의 오랜 숙적이 다시 나타난다.숙적 루드베키아는 약혼을 제안하고,혼란스러워하면서도 칼미아는 자신이 그토록 바라는 후계 자리를 위해 그의 손을 잡는다.이번 생에도 그녀는 백작이 될 것이다.제 힘으로 쟁취해서, 오랜 숙적을 물리치고, 누구의 허수아비도 아닌 온전한 백작이.","스토리, 로맨스",15세 이용가,목
303,온새미로,여우 / 사문,9.91,"배우 지망생 해리는 특집 드라마 ‘무영탑’ 오디션 준비를 위해 방문한 국립 부여 박물관에서 신비로운 분위기의 백제 유물 ‘금동대향로’에 이끌린다.해리로 인해 금동대향로 속에 갇혀 있던 천신의 아들 ‘온새미로’가 깨어나고, 멈춰져 있던 인연의 굴레가 다시 움직이기 시작한다.","스토리, 로맨스",전체연령가,목
304,로맨틱 태평수산,육일공,9.95,"""더 이상 불로소득은 없다! 상속이 받고 싶으면 그럴만한 능력을 갖추거나 능력 있는 놈과 결혼해!""부잣집 외동딸 '태평' 어느 날 독립통보를 받는다.이제 그녀에게 남은 건 다 망해가는 횟집 '태평수산'뿐이다.  길거리에 나앉기 일보 직전, 태평은 한 남자가 물고기로 둔갑하는 장면을 목격하는데...젊은이가 씨가 마른 어촌 마을 유일한 신랑감 후보는 물고기?!누가 내 남편이 될 물고기인가. 육일공 작가의 신작!","스토리, 로맨스",전체연령가,목
305,부캐인생,까를로스 / 징크,9.72,"존재감 없이 살아온 20살 지원. 그는 자신의 생일날 삶을 마감하려 한다. 하지만 우연히 만든 부캐로 인해 인생이 뒤바뀌고, 현실 ‘아싸’ 임지원은 부캐 ‘인싸’ 김시후로 살아가게 된다. 점점 부캐의 삶에 빠져들수록 지원은 자신의 존재감을 잃어가고, 결국 부캐를 죽이기로 결심하는데... 그는 부캐로 얻은 모든 것을 뒤로하고 다시 본인 자신으로 돌아갈 수 있을까.","스토리, 드라마",15세 이용가,목
306,방과후 레시피,혜루,9.97,음식을 사랑하는 소녀 소금은 꿈에 그리던 요리 고등학교에 합격한다.학교에 진학하기 위해 이모네 집으로 이사하게 된 소금은 그곳에서 자신에게 상처를 주었던 첫사랑 은재와 재회한다.우리는 과연 예전처럼 다시 친해질 수 있을까?요리고에서 펼쳐지는 단짠단짠 순정 로맨스!2021 '첫사랑을 찾습니다' 로맨스 공모전 대상 수상작.,"스토리, 로맨스",전체연령가,목
307,환상연가,반지운,9.97,"왕을 시해하려다 기억을 잃고 쓰러진 자객이 다음 날 후궁으로 책봉된다면?반역자로 몰려 몰살당한 연씨 가문의 유일한 생존자 연월은 왕에게 복수하기 위해 자신의 신분을 숨긴 채 자객이 된다.무희로 잠입해 은밀히 왕의 목을 노리지만, 왕이 쳐 놓은 덫에 빠져 오히려 독한 향에 정신을 잃고 쓰러진다.다음 날, 연월은 과거의 기억을 잃은 채 눈을 뜨게 되고, 뜻밖에 왕명을 받아 후궁 은효비에 책봉된다.현왕은 자신을 죽이러 온 자객인 연월을 후궁으로 들인 악희의 소행에 분노하며 후궁전으로 달려가 연월을 죽이려 하지만,도리어 악희에게 몸의 통제권을 빼앗기고 마는데...","스토리, 로맨스",전체연령가,목
308,"황궁에 핀 꽃은, 미쳤다",한누리 / 희구 / 성소작,9.9,태사국 철부지 황태자 이헌은 오로지 자신이 좋아하는 평민을 후궁으로 들이려 태사국 대장군의 딸 서류하와 애정 없는 혼인식을 올린다. 하지만... 고분고분 순진한 아가씨인줄 알았던 서류하의 실체는 카리스마 넘치는 여장부 그 자체. 예상치 못한 피 터지는 첫날밤을 보내게 된 이헌은 자신이 크게 실수했음을 깨닫지만 이미 늦었다. 모든 것은 서류하의 계획 아래에 있다.폭풍처럼 몰아치는 서류하에게 속절없이 흔들리며 나아가는 태사국과 이헌의 이야기.,"스토리, 로맨스",전체연령가,목
309,따개비,뜰새 / delete / ...,8.75,"작은 무인도, 굴덕도의 등대 관리 공무원 이어진.평소처럼 평화롭고 지루한 등대에서 시간이나 때우던 어느 날,친한 낚시꾼이 넘겨준 감생이에서 표피를 뚫고 나온괴이한 따개비를 보게 된다.그리고 그 후...","스토리, 스릴러",15세 이용가,목
310,관계중독,오얏,9.76,"잘나가는 것에 대한 환상을 품고 있던 평범한 여고생 '설단아'는 우연히 노는 아이들 무리와 친해진 후 그 무리에 적응하려 애쓰는 중이다. 그러던 중 전혀 못 알아볼 정도로 외면도, 내면도 끔찍하게 변한 단아의 '첫사랑'이 전학 오고, 과거 설단아와의 추억에 갇혀버린 첫사랑은 단아에게 소름 끼치게 집착한다. 간신히 무리에 적응 중이던 단아에겐 악몽 같은 일이다. 설상가상으로 무리의 대장 격인 불량아와도 그로 인해 트러블이 생기는데...","스토리, 스릴러",15세 이용가,목
311,돌아온 여기사,이하린 / 하늘미르,9.88,"평범한 백작가 영애로 살아가던 ""이레나"". 그녀의 가문은 반왕 ""파벨루크""로 인해 하룻밤 만에 숙청당하고 만다. 가족의 복수를 위해 냉혹한 기사로 살아가던 그녀는 무슨 이유에서인지 과거로 되돌아가게 되었다.가족을 끝까지 지키기 위해선 지난 생에서는 죽었던 황태자 “칼라일”을 살려야 한다!낮에는 레이디, 밤에는 검을 든 기사로 바쁘게 오가는 이레나. 이번에는 미래를 바꿀 수 있을까?!","스토리, 로맨스",15세 이용가,목
312,그 황제가 시곗바늘을 되돌린 사연,화영 / 용끄 / 블루밍부케,9.91,"황후 리지가 숨을 거둔 뒤에야 황제 레온은 자신의 어리석음을 깨닫고 후회했지만 이미 시곗바늘은 지나갔다.레온의 소원으로 시계탑의 마녀는 레온이 황후 리지를 처음 만나던 날로 시곗바늘을 되돌리고, 과거로 돌아간 레온에게 남은 일은 오직 리지를 행복하게 해주는 일 뿐...하지만, 되돌린 시곗바늘의 영향력은 생각하는 것 이상으로 컸는데... 과연 레온은 리지를 행복하게 해 줄 수 있을까?","스토리, 로맨스",전체연령가,목
313,아빠같은 남자,이수민,9.8,"“마음에 드실거예요. 아빠같은 남자거든요.”사이코패스 성격을 숨기고 살아가는 로펌대표 묘인준은 자신의 본성을 잘 감춘 채 재력과 권력, 그리고 겉보기에 화목한 가정까지 모든 걸 갖추고 살아가고 있다. 어느 날 끔찍히 사랑하는 외동딸 수진이 아버지 묘인준에게 결혼할 남자(정이현)를 소개하게 되는데, 묘인준은 그 순간 딸의 남자가 자신과 같은 부류의 인간임을 알아본다. 자신이 이룬 모든 것의 상징과도 같은  딸을 향해 접근하는 것은 물론, 여러 의심스러운 상황에서 계속 마주치게 되는 정이현...묘인준은 그에게 딸을 뺏길 수 없다는 생각을 하게 되지만, 자신의 두 얼굴을 들키지 않으면서 딸을 지키기란  쉽지 않다. 거기에 더해 자신과 자신의 회사 법무법인 노블의 주변에서는 끊임없이 잡음이 들려오기 시작하고, 묘인준의 내재된 본성이 서서히 모습을 드러내며  상황은 점점 복잡해진다.","스토리, 드라마",12세 이용가,목
314,권리행사자,샤이탄,9.67,"어떠한 간섭도 없이 행할 수 있고모두가 그걸 당연하게 생각하는 능력, 권리.'무엇이든 누를 수 있는 권리'를 이용해편리한 나날을 보내고 있던 '주희성'의 앞에,권리를 인지할 수 있는 소녀 '천아람'이 나타나희성의 일상에 간섭하기 시작한다.예상치 못한 상황을 마주한 희성 앞에,'권리행사자'들이 서로의 권리를 침해하는 새로운 국면이 펼쳐지는데...과연 희성이는 자신의 권리를 지킬 수 있을까?!","스토리, 판타지",15세 이용가,목
315,배트맨: 웨인 패밀리 어드벤처,CRC Payne / St...,9.81,"네이버웹툰 슈퍼캐스팅 프로젝트. 어디서도 본 적 없는 DC의 오리지널 '배트맨' 스토리를 웹툰으로 감상하세요!""배트맨도 쉬고 싶다! 슈퍼히어로 보다 어렵다는 아빠 노릇?!""","에피소드, 일상",전체연령가,목
316,이계 무슨 황비,전현서 / GUA,9.91,"""안녕하세요, 고객님. 상담원 진예롬입니다. 네? 이세계에서 전화 주셨다구요?""콜센터 상담원 예롬은 진상 고객을 찾아가던 중 이세계 초국에 도착하고,얼떨결에 그곳의 황제 비위 전담 대신이 되는데.. 이세계에서 펼쳐지는 이색 황궁 로맨스!","스토리, 로맨스",12세 이용가,목
317,시에라,문아 / Rana,9.94,"비슷한 이유로 태어나 비슷한 이유로 불행했던 공작가의 인형 '시에라'와 황제의 사생아 '클로드'. 아무에게도 말할 수 없는 관계를 유지하던 두사람에게 불행이 찾아온다.“다시 시간을 되돌릴 수 있다면, 다른 선택을 할 수 있게 해 줘”밀려오는 후회를 감당하지 못하는 시에라, 눈을 떠보니 그녀의 옆에는 클로드가 있는데…","스토리, 로맨스",전체연령가,목
318,베어케어,꽃소금 / 김용원,9.53,"낮에는 까칠도도 문 상무, 밤에는 털찐 바보 '곰'이 되는 남자 문웅.어느날 그의 은밀한 이중생활에 자칭타칭 대형사고 콜렉터, 비서 연조가 들어온다.밤마다 포텐 터지는 자신의 귀여움을 숨기고픈 문웅과반드시 그의 정규직 비서가 되려는 연조의 '임시보호' 계약 동거가 시작된다!","스토리, 로맨스",전체연령가,목
319,유월의 소한,윤정민,9.64,"잃어버린 첫사랑 '청명'을 잊지 못하는 왕의 서자 '소한군' 다시는 누군가를 사랑하지 않으리라 다짐했지만, 왠지 낯설지 않은 여인 '유월'을 만나게 되고 묘한 감정에 휩싸인다. 하지만 첫사랑과 겹쳐 보이는 그녀는 자꾸만 그를 밀어내는데... 과연 두 사람의 인연은 어디로 흘러가게 될 것인가.","스토리, 로맨스",전체연령가,목
320,온실 속 화초,옛사람,9.96,"<성공한 덕후> 옛사람 작가의 미스터리 시트콤 신작!호텔 VVIP 였던 남매는 하루아침에 집안이 망해 길거리로 나앉는다. 그들은 보물이 가득하다는 숲속의 성에 대한 소문을 듣게 되고, 그 성으로 떠나기로 한다.비밀스러운 땅굴을 통해 겨우 찾아간 성에는 남자도 반하게 하는 극강미모의 미스터리한 왕자가 살고 있었다.어딘가 스산한 분위기인데… 성 밖으로 나가는 출구가 사라져버렸다?!'온실 속 화초'처럼 살아왔던 그들의 독립과 사랑을 찾아가는 이야기!​","스토리, 드라마",전체연령가,목
321,카루나,강호진,9.81,지옥의 군대와 맞서는 항마승병 카루나.카루나에 도전하는 소년액션 모험 판타지!,"스토리, 판타지",12세 이용가,목
322,널 사랑하는 죽은 형,상금,9.94,쌍둥이 형을 교통사고로 잃은 송태한.하지만 집으로 돌아와보니 죽은 형이 귀신이 되어 돌아왔다.빙의를 할 수 있다는 사실을 알고 형을 위해 자신의 몸을 '나눠' 쓰기로 결심하지만그런 형이 갑자기 전학생에게 첫눈에 반하게 되는데…,"스토리, 로맨스",12세 이용가,목
323,나쁜 마법사의 꿈,이아거,8.82,"평범한 중학생 '이대아', 집에서 도망치고 싶어 아무 기숙고등학교에 원서를 넣었다. 그런데 알고 보니 이곳은 예술 고등학교로 위장한 마법학교였고, 전혀 상관없는 곳인 줄 알았던 이 학교에서 ‘이대아’와 얽힌 비밀이 드러나기 시작한다! “나는 마법사인 척 모두를 속여 이 학교에 남아야 해. 무슨 방법을 써서라도.""","스토리, 판타지",전체연령가,목
324,자취방 신선들,마로,9.95,옥황상제를 꿈꾸는 선녀 '묘령'. 인간들이 아파트를 짓느라 산을 밀어버리는 바람에 백수가 되어버린 산신 '한호'. 그리고 인간이웃인 생계형 바람둥이 '민우'와 사회성 제로 오타쿠 '나라'. 4인방이 펼치는 본격 판타지 시트콤 드라마!,"스토리, 드라마",전체연령가,목
325,보물과 괴물의 도시,이을,9.95,"""그 지진사고 날 부터 내 눈에 괴물들이 보여.""빠르게 변해가는 도시에서, 사라져가던 거리의 유물들이 인간에게 들러붙기 시작했다.","스토리, 판타지",12세 이용가,목
326,연애의 발견,별곡 / 멍짖,9.83,"5년 전, 가슴 아픈 첫사랑과 홀로 이별한 ‘여름’.공허한 아픔을 뒤로하고 다시 일어날 기회를 준 건 새로운 남자친구 ‘하진’이었다.하지만 사랑하는 하진이 가진 타인과 선 자리,분노한 여름은 하진의 선 자리로 향하는데…그곳에서 첫사랑이었던 강태하를 만난다.강태하, 네가 왜 여기에 있어?!","스토리, 로맨스",전체연령가,목
327,모어 라이프,이아영,9.94,"모두가 두 개의 목숨을 가진 세계! 태어날 때부터 목숨이 하나였던 영하는 늘 주변의 걱정과 과보호 속에 자랐다.대학생이 된 후 어렵사리 카페 알바에 도전한 영하, 그곳에서 본인보다 더 평범하지 못한 주희를 만나게 되는데...목숨이 두 개인 세계에서 평범하지 못한 두 남녀의 목숨이 걸린 로맨스!","스토리, 로맨스",전체연령가,목
328,사랑하는 여배우들,고나리자 / 수정,9.94,"“스타가 된 구 남친 '우주'를 못 잊는 여대생 '초원'에게, 혼수상태에 빠진 국민 여신 '차유진'의 혼령이 빙의했다?!” 억울한 사고의 진실을 찾기 위해 '초원'에게 빙의한 인기 여배우 '유진'은 초원을 배우의 길로 밀어 넣는다. 얼떨결에 연기하게 된 초원은 '국민배우 공연준'에게 차유진의 카피배우 취급을 당하며 우주 앞에서 망신을 당하게 되지만, 점점 자신만의 연기를 찾아 진정한 배우로 성장해간다. 유진 역시 초원의 도움으로 조금씩 사고 당일의 진실에 가까워져 가는데...!","스토리, 로맨스",전체연령가,목
329,가상&RPG,주다현,9.91,"""사람은 좀 죽여도 싸우는건 싫어해요."" 게임에서조차 집 바깥을 나가지 않는 '제리'. 전투는 한 번도 안해봤는데, 에픽 무기가 귀속되었다? 가상현실 액션 RPG 모브사가 온라인. 그 고인물들의 군상극.","스토리, 판타지",12세 이용가,목
330,외모지상주의,박태준,9.47,못생기고 뚱뚱하다고 괴롭힘을 당하며  루저 인생만 살아온 내가 잘생겨졌다는 이유로 인싸가 됐다.어느 날 자고 일어났더니 갑자기 완벽한 외모와 몸을 지닌 사람이 되어 깨어난다면?,"스토리, 드라마",15세 이용가,금
331,대학원 탈출일지,요다,9.97,연구에 꿈을 가지고 대학원을 선택한 병아리 요다.예상과는 다르게 연구에 관심 없는 교수님과 똥군기의 연구실 분위기에 당황한다.요다는 과연 무사히 대학원을 탈출할 수 있을 것인가?!,"에피소드, 일상",전체연령가,금
