Contents,Like,ID,Tags
익산 부송동 네네치킨_   전북 익산시 부송로14길 21  네네치킨 x 배달의민족네네치킨 4천원에 드세요 배민 1월 네네치킨 첫 주문 혜택_ 네네치킨 후라이드 16 000  쿠폰 적용가  4 000  2023년 1월 4일 수  1월 31일 화  까지 진행  배달의민족 앱 쿠폰함에서 1월네네치킨첫주문을 입력하고 쿠폰등록을 누르면 첫주문 12 000 할인쿠폰이 쏙   익산 부송동 네네치킨_ 낮 12시   밤 11시 30분   네네치킨 기본_치킨무  콜라  양념소스  스위트콘   바삭한 웨지감자와 달콤한 짜용소스의네네치킨  포테이토짜용치킨  19 000   순살 2 000   21 000  부송동 배달팁  3 000  네네치킨 포테이토짜용치킨은 예전에 반반메뉴로 시켜서 먹었던 적이 있는데  이렇게 통짜로 시킨건 첨  19 000원인 포테이토짜용치킨 메뉴 선택은뼈  0  순살  2 0  다리  3 0  날개  3 0다리반 날개반  3 0  윙봉  3 0  네네치킨  포테이토짜용순살 노릇노릇한 웨지감자가 왜케 맛나보임 순살은 또 왜케 보들보들 짜용  네네치킨 포테이토짜용치킨이잖아 노오란 머스타드 소스 같지만  마요가 섞인  요거 어디서 먹어봤더라  생각이 날듯 말듯  네네치킨  네네치킨배달의민족  네네치킨배달  익산네네치킨  네네치킨포테이토짜용  포테이토짜용치킨  포테이토짜용  치킨  chicken  먹스타그램  익산부송동 ,3.0,candy._.mukstagram,"['#네네치킨', '#네네치킨배달의민족', '#네네치킨배달', '#익산네네치킨', '#네네치킨포테이토짜용', '#포테이토짜용치킨', '#포테이토짜용', '#치킨', '#chicken', '#먹스타그램', '#익산부송동\u200b']"
 북삼  북삼맛집  치킨  배통  얼음컵  감동이야  장사잘되게  홍보해줘야해오늘은 후라이드다,6.0,gimdohye516,"['#북삼', '#북삼맛집', '#치킨', '#배통', '#얼음컵', '#감동이야', '#장사잘되게', '#홍보해줘야해오늘은']"
20230109월저녁은  bhc  치킨 뿌링클 치킨은후라이드 우리애들최애치킨요즘 내가 미쳤구나 ,8.0,heohyeonju35,"['#bhc', '#치킨', '#뿌링클', '#치킨은후라이드', '#우리애들최애치킨요즘']"
치킨은 언제나 옳다 Chicken is always right  food  foodstagram  foodporn  chicken  bake  friedchicken  mukbang  delicious  먹스타  먹방  먹스타스램  치킨  굽네치킨  classic  kfc  koreanchicken  hotchick  hotchicken,9.0,biyo.official1,"['#food', '#foodstagram', '#foodporn', '#chicken', '#bake', '#friedchicken', '#mukbang', '#delicious', '#먹스타', '#먹방', '#먹스타스램', '#치킨', '#굽네치킨', '#classic', '#kfc', '#koreanchicken', '#hotchick', '#hotchicken']"
역시 설맥 치킨 맛있다 허겁지겁 내가 다 먹은 듯 수희언니가 나 왤케 잘먹냐고   나가사키도 맛있다 간단하게 딱 한 잔씩만  좋은사람들과    설맥  치킨  나가사키,13.0,cuo_1206,"['#좋은사람들과', '#설맥', '#치킨', '#나가사키']"
마니골뱅이 역삼동이 집 시그니처 메뉴치킨 크랩 튀김을지로골뱅이 계란말이넘나 맛있는곳   아   또 가야쥐 서울맛집  강남맛집  역삼동맛집  역삼역맛집  마니골뱅이  치킨  크랩  을지로골뱅이  계란말이  치맥  뻥튀기맛집,11.0,bangbae_samo,"['#서울맛집', '#강남맛집', '#역삼동맛집', '#역삼역맛집', '#마니골뱅이', '#치킨', '#크랩', '#을지로골뱅이', '#계란말이', '#치맥', '#뻥튀기맛집']"
야식 땡기는 밤      데일리  daily  야식  치킨  치맥  치소  양념치킨,17.0,aud_gyu.96,"['#데일리', '#daily', '#야식', '#치킨', '#치맥', '#치소', '#양념치킨']"
 휴게소음식휴게소 음식 국룰 라면과 우동아닌가요   해외여행끝나고 입국하자마자 바로 먹은뜩근한 우동과 라면은 정말 사랑이네요  하하 인친님들의 휴게소 최애 메뉴는    ෆ   ෆ   ෆ   ෆ   맛스타그램 맛집추천 맛집탐방 포항맛집 포항여행 포항가볼만한곳 포항핫플 포항 포항카페 포항술집 영일대맛집 영일대해수욕장 치킨맛집 소통 먹팔 먹스타맞팔 먹팔맞팔 해운대맛집 영일대해수욕장맛집 치킨 포항시내맛집 쌍사술집 라면 우동맛집  likeforlikes likeforfollow I4I f4f fff,61.0,yum2_yom2,"['#휴게소음식휴게소', '#맛스타그램', '#맛집추천', '#맛집탐방', '#포항맛집', '#포항여행', '#포항가볼만한곳', '#포항핫플', '#포항', '#포항카페', '#포항술집', '#영일대맛집', '#영일대해수욕장', '#치킨맛집', '#소통', '#먹팔', '#먹스타맞팔', '#먹팔맞팔', '#해운대맛집', '#영일대해수욕장맛집', '#치킨', '#포항시내맛집', '#쌍사술집', '#라면', '#우동맛집', '#likeforlikes', '#likeforfollow', '#I4I', '#f4f', '#fff']"
  도전   출결왕   우리 내일도 또 보자      눈높이러닝센터 실옥학원에서는1월 9일 월  2월 24일 금  6주간  출결이벤트를 진행합니다   자신있는 신학기를 위해  정해진 요일에 센터에 와서 재미있게 공부해요     아산  실옥  신정초  천도초  출석  이벤트  치킨  이어폰  핫팩  스타벅스,11.0,noonnoppi_asan,"['#아산', '#실옥', '#신정초', '#천도초', '#출석', '#이벤트', '#치킨', '#이어폰', '#핫팩', '#스타벅스']"
닭낡개를 살짝 밑간해서녹말가루에 굴려 튀긴다음간장  설탕  물엿  식초  레몬즙  청주고추  마늘  파 다진거 넣고교촌스타일 파닭 스타일 짬뽕해서하이볼과 함께 마셨다 ,26.0,lea_lea_kitchen,[]
 호식이두마리치킨  간장치킨  뼈한마리  치킨  한마리  호식이간장치킨  호식이두마리간장치킨,0.0,dk0108,"['#호식이두마리치킨', '#간장치킨', '#뼈한마리', '#치킨', '#한마리', '#호식이간장치킨', '#호식이두마리간장치킨']"
야식으로 교촌치킨   생맥주     치킨맛집 교촌치킨      일상  일상스타그램  풍경스타그램  일상스냅사진  travelgram  travelphotographer  캠핑요리  먹방  먹스타  먹스타그램  사진계정맞팔  사진소통환영  일상소통맞팔  일상소통환영  좋아요그램  좋아요반사테러  먹팔해요  먹팔  먹팔환영  먹팔맞팔  팔로우  선팔  맞팔  선팔하면맞팔  선팔맞팔  맞팔환영  치맥  야식  치킨  냠냠,138.0,baby1126426,"['#일상', '#일상스타그램', '#풍경스타그램', '#일상스냅사진', '#travelgram', '#travelphotographer', '#캠핑요리', '#먹방', '#먹스타', '#먹스타그램', '#사진계정맞팔', '#사진소통환영', '#일상소통맞팔', '#일상소통환영', '#좋아요그램', '#좋아요반사테러', '#먹팔해요', '#먹팔', '#먹팔환영', '#먹팔맞팔', '#팔로우', '#선팔', '#맞팔', '#선팔하면맞팔', '#선팔맞팔', '#맞팔환영', '#치맥', '#야식', '#치킨', '#냠냠']"
웁쓰    인스타툰  일상툰  그림일기  그림에세이  취미그림  아이패드드로잉  다이어트  운동  스쿼트  치킨  윤꾸리툰  윤꾸리의일상,93.0,ggggguri_u,"['#인스타툰', '#일상툰', '#그림일기', '#그림에세이', '#취미그림', '#아이패드드로잉', '#다이어트', '#운동', '#스쿼트', '#치킨', '#윤꾸리툰', '#윤꾸리의일상']"
돈까스집에서 통닭을 판다   오징어튀김도    또간다 서울  여의도 여의도돈가스  여돈호프 치킨  옛날통닭  19000 생맥  3500,52.0,foodie_janny,"['#서울', '#여의도', '#여의도돈가스', '#여돈호프', '#치킨', '#옛날통닭', '#19000', '#생맥', '#3500']"
I can eat spicy food and then I will feel bad   But I m happy   Я могу наесться острого  а потом мне будет плохо   Зато я счастлива,126.0,__annele__,[]
오늘 상경해서 간만에 둠칫둠칫  영기오빠껀 언제나 넘 신나고 즐거운데 넘나 힘들다    ㅋㅋㅋㅋㅋ저렇게 움직이면서 라이브하는 오빠가 새삼 대단쓰  고생한다며 간식 사준 오빠 감사해여    노브랜드 버거 첨 먹어보는데 넘나 맛있음     잘 먹었습니다    퇴근 후 떡볶이랑 취킨도 맛있게 잘 먹었어요  고맙쿄  상경  오랜만에  연습실  둠칫둠칫  연습  즐겁나  신난다  힘들다  대단해  영기  잘먹었습니다  노브랜드  햄버거  감자튀김  첫경험  너무맛있어  감사합니다  퇴근후  치킨  떡볶이  야식  고맙쿄,80.0,kmj_sm_hyj,"['#상경', '#오랜만에', '#연습실', '#둠칫둠칫', '#연습', '#즐겁나', '#신난다', '#힘들다', '#대단해', '#영기', '#잘먹었습니다', '#노브랜드', '#햄버거', '#감자튀김', '#첫경험', '#너무맛있어', '#감사합니다', '#퇴근후', '#치킨', '#떡볶이', '#야식', '#고맙쿄']"
제주맥주 행사안내제주맥주3병을 드시면 민트색 우산을드리는 행사를 4월까지 진행합니다 맛있는 제주맥주 드시고예쁜 우산도 받으세요 아트소스  고덕로96 7 1층 암사동 02 6449 1123 평일 매일 18 00오픈토 일 휴일 17 00오픈휴일은 둘째 넷째주 일요일입니다  LP음악 뉴트로 감성팝송맛집 추억여행 음악신청 추억의음악다방 신청곡 PUB카페 DJ 오늘 카스생맥주 치킨 맥주 수제양념떡볶이 수제양념골뱅이 파인애플샤벳트 국내산무뼈닭발 새로소주 소맥 음료 음악레코드 바이닐 방역 암사동선사고강일중버스정류장 강동롯데캐슬퍼스트주변 프라이어팰리스 강동현대홈타운주변 강동구 암사동음악맛집 대관 단체모임예약,5.0,artsource.pub,"['#뉴트로', '#감성팝송맛집', '#추억여행', '#음악신청', '#추억의음악다방', '#신청곡', '#PUB카페', '#DJ', '#오늘', '#카스생맥주', '#치킨', '#맥주', '#수제양념떡볶이', '#수제양념골뱅이', '#파인애플샤벳트', '#국내산무뼈닭발', '#새로소주', '#소맥', '#음료', '#음악레코드', '#바이닐', '#방역', '#암사동선사고강일중버스정류장', '#강동롯데캐슬퍼스트주변', '#프라이어팰리스', '#강동현대홈타운주변', '#강동구', '#암사동음악맛집', '#대관', '#단체모임예약']"
 리그램    bareun_mket by  get_regrammer  2023 계묘년 맞이 팔로우 이벤트    bareun_mket 팔로우  하고 게시글 좋아요  꾹  누른 뒤댓글만 남기면 참여 완료  참 쉽죠   바른마켓 팔로우하고 제품  특가할인 소식 챙겨가세요   당첨확률 올리는 꿀TIP  댓글에  친구소환 하면 확률 UP 게시물 공유하면 2배로 UPUP   이벤트 참여 기간  23  01  09  월    23  01  24  화   이벤트 경품  BHC 후라이드치킨 콜라 1 25L  5명 스타벅스 아이스 카페 아메리카노 Tall  10명   당첨자 발표  23  01  27  금  2023년에도 여러분에게 더  좋은 제품으로찾아 뵙는 바른마켓이 되겠습니다      바른마켓 을 구경하고 싶다면    프로필 링크 클릭   https   smartstore naver com smhael 바른마켓  온라인쇼핑몰  이벤트  팔로우이벤트 BHC  치킨  기프티콘  스타벅스  이벤트참여 경품  치킨세트  팔로우  좋아요  event,1.0,hyeonsug1357,"['#리그램', '#특가할인', '#바른마켓', '#온라인쇼핑몰', '#이벤트', '#팔로우이벤트', '#BHC', '#치킨', '#기프티콘', '#스타벅스', '#이벤트참여', '#경품', '#치킨세트', '#팔로우', '#좋아요', '#event']"
 진푸드  야식  치킨  의왕맛집  오늘은  교촌치킨 이것도 먹고 싶고 저것도 먹고 싶을 땐 반반   ,117.0,zyn_food,"['#진푸드', '#야식', '#치킨', '#의왕맛집', '#교촌치킨']"
 D 76  오늘 N줄일기1  어제 미처 다 못끝낸 문제의 나머지 분량   오늘 껀 지금 시작할거2  노트북 사양 업글하려고 아침에 당근으로 부품 사러 다녀옴3  이제서야 첨 먹어본거 찐따같긴 한데 우유사러 갔다가 팔길래 4  카카오랑 LG에너지솔루션은 지금 사도 안늦습니다 ㄱㄱ하셈5  미세먼지 많은 거 맞음  오늘 하늘 맑고 따뜻하고 예뻤음6  중요한건 떡볶이 국물에 찍어먹는 치킨  떡볶이는 필요없다7  두 달 만에 미용실 예약  거지존 탈출 거의 다왔다ㅠㅠ,77.0,pol_junee,[]
 고런육회   국내산 한정판매 고런 육회  육회 200g   노른자   치즈   흑임자소스   배 무순 영업시간 오후4 30 새벽1 30 고런 육회  갈비양념 육회  깐풍 양념 육회  고추장 육회 총 4개의 맛으로 준비했습니다  반반 육회 주문으로 원하는 맛 두가지를 선택도 가능합니다  사진의 육회가 메뉴 1개의 양입니다 반반 육회 주문 시 100g씩 나누어 담기 위해 두칸 용기를 사용했습니다  많이 팔기 전에 신선한 육회를 드리고자 현재는 하루 1kg 5개 만 준비합니다 어제는 밤9시에 조기 품절 되었네요 하루 10개 준비 할 수 있도록 많은 관심 부탁드립니다   고런  치킨  떡볶이  치떡  둔전맛집  포곡맛집  에버랜드맛집  육회  곱도리탕  gorun  chittuk  chicken  tteokbokki  성난요리사  ,21.0,djo_onp,"['#고런육회', '#고런', '#치킨', '#떡볶이', '#치떡', '#둔전맛집', '#포곡맛집', '#에버랜드맛집', '#육회', '#곱도리탕', '#gorun', '#chittuk', '#chicken', '#tteokbokki', '#성난요리사']"
  1 9 월  조기 마감   화 목 휴무 안내   처갓집 오목교점 02 2645 9982  쿠폰 10장 모으면 후라이드 한마리 이벤트중    02 2645 9982       오늘도 많은 사랑과 관심 감사합니다 1 10 1 12 충전하고 1 13 뵙겠습니다  목동성당 옆  8단지 건너편 제이월드빌에 위치한 처갓집양념치킨   오목교점  이예요주문시 오목교점 또는 제이월드빌을 확인해주세요       배민 요기요 쿠팡이츠 등에서 처갓집 오목교점 검색후 찜 눌러주세요        ,12.0,everyday.chickenday,[]
빠싹빠싹 눠랭퉝뒑쓰  존맛  노랑통닭  치킨  치킨맛집  맥주  치킨엔맥주  맛스타그램  먹스타그램  맛팔  맞팔  먹팔  선팔  좋아요  후라이드짱짱,19.0,pignonge,"['#노랑통닭', '#치킨', '#치킨맛집', '#맥주', '#치킨엔맥주', '#맛스타그램', '#먹스타그램', '#맛팔', '#맞팔', '#먹팔', '#선팔', '#좋아요', '#후라이드짱짱']"
 교촌에 치맥  치맥은사랑입니다   2022 12 22 ,12.0,ssun_hh,['#치맥은사랑입니다...2022.12.22♥']
  피자나라 치킨공주 피자나라치킨공주  피자  치킨,4.0,2heartracing,"['#피자나라치킨공주', '#피자', '#치킨']"
Posted  withregram    icouncil103  2023 신년맞이 SNS 친구추가 이벤트 인천시의회 인스타그램 팔로우하고 추첨을 통해 상품도 받으세요    이벤트 참여 방법① 인천시의회 인스타그램  icouncil103  팔로우하기 ② 상품 배송을 위한 정보 입력하기   프로필 링크 클릭 ③ 해당 이벤트 게시글에 팔로우한  아이디  댓글로 남기기  3번까지 모두 진행시 참여 완료    이벤트 기간   2023  1  9  월    1  17  화    총 8일간   이벤트 경품   치킨세트 기프티콘 총 25명  아이스크림 기프티콘 총 25명    당첨자 발표   2023  1  20  금 인천시의회에서 전해드리는 다양한 콘텐츠에  좋아요 와  댓글  많이 부탁드립니다   당첨 시 본 계정 팔로우를 유지하고 있어야 경품 발송이 가능합니다   수집된 정보는 상품 발송을 위해서만 사용합니다  이벤트  인천시의회  인천광역시의회  인천  인천시  당첨자  이벤트당첨  아이스크림  SNS  SNS이벤트  치킨,24.0,tngus5306,"['#이벤트', '#인천시의회', '#인천광역시의회', '#인천', '#인천시', '#당첨자', '#이벤트당첨', '#아이스크림', '#SNS', '#SNS이벤트', '#치킨']"
치킨먹자  야식은 치킨이지       일상 저녁 야식 내돈내산 치킨 교촌치킨 교촌콤보웨지감자세트 먹스타 맛스타그램 요리 음식 집밥 홈쿡 간식 배달 배달음식 요리스타그램 집밥스타그램 저녁스타그램 야식스타그램 간식스타그램 치킨스타그램 주부스타그램 맘스타그램,328.0,miyo_523,"['#일상', '#저녁', '#야식', '#내돈내산', '#치킨', '#교촌치킨', '#교촌콤보웨지감자세트', '#먹스타', '#맛스타그램', '#요리', '#음식', '#집밥', '#홈쿡', '#간식', '#배달', '#배달음식', '#요리스타그램', '#집밥스타그램', '#저녁스타그램', '#야식스타그램', '#간식스타그램', '#치킨스타그램', '#주부스타그램', '#맘스타그램']"
 후라이드  후라이드치킨  치킨  감자튀김  감튀  맥주  롤링힐스  롤링힐스호텔  룸서비스  먹스타그램  맛스타그램  food  foodstagram,13.0,bebuller,"['#후라이드', '#후라이드치킨', '#치킨', '#감자튀김', '#감튀', '#맥주', '#롤링힐스', '#롤링힐스호텔', '#룸서비스', '#먹스타그램', '#맛스타그램', '#food', '#foodstagram']"
월요일이라 한잔  술이달다 꿀맛 술이술술   덕분에행복 언제든지  생맥주 맥주사랑 교촌맥주 맥주맛집 치킨 월요일이라한잔 jmt 수제맥주 교촌수제맥주 꼭드셔보세요,14.0,sport1729,"['#술이달다', '#꿀맛', '#술이술술', '#🍻', '#덕분에행복', '#언제든지👌', '#생맥주', '#맥주사랑', '#교촌맥주', '#맥주맛집', '#치킨', '#월요일이라한잔', '#jmt', '#수제맥주', '#교촌수제맥주', '#꼭드셔보세요']"
 김밥Classic is the best  美味しい野菜 キンパ もおすすめ  太巻きに似てますがお味は全然違いますよ ゴマと塩で味つけた白いご飯に色んな野菜を入れて巻いたキンパ 是非食べてみて下さいね  野菜キンパ  キムチチーズキンパ  チョッパル  韓国チキン  papachicken  パパチキン本店  サムギョプサル  那覇韓国グルメ  韓国料理  国際通り 美味しい  koreanfriedchicken  okinawakoreanfood  okinawalife  samgyupsal  koreanfood  오키나와맛집  치킨  삼겹살  찐한국맛,24.0,papachicken_honten,"['#김밥Classic', '#キンパ', '#野菜キンパ', '#キムチチーズキンパ', '#チョッパル', '#韓国チキン', '#papachicken', '#パパチキン本店', '#サムギョプサル', '#那覇韓国グルメ', '#韓国料理', '#国際通り', '#美味しい', '#koreanfriedchicken', '#okinawakoreanfood', '#okinawalife', '#samgyupsal', '#koreanfood', '#오키나와맛집', '#치킨', '#삼겹살', '#찐한국맛']"
 청년다방  청년다방떡볶이  청년다방차돌박이떡볶이  차돌박이떡볶이  차돌박이  떡볶이  버터갈릭감자튀김  감자튀김  치킨  후라이드치킨  먹스타그램  맛스타그램  food  foodstagram,9.0,bebuller,"['#청년다방', '#청년다방떡볶이', '#청년다방차돌박이떡볶이', '#차돌박이떡볶이', '#차돌박이', '#떡볶이', '#버터갈릭감자튀김', '#감자튀김', '#치킨', '#후라이드치킨', '#먹스타그램', '#맛스타그램', '#food', '#foodstagram']"
 연희동 맥시칸 치킨 길냥이 고양이별 웅이 두령이 길천사 펫24 너와함께 안녕 연희동에 살면서  그래두 좋은 치킨집 사장님 사모님덕에 안에서두지내고 두령이집에서 잘 지내던 너인데너무 약하게 태어났고  늦게 그래두 좋은곳서 지내서 다행이다 싶었는데 항상하는 설사땜에 큰병원까지가서 검진도 하고  근데 별 이상 없다고 했는데   5년이 넘는 시간  널 알아서 행복했어 웅이야 치킨집 안에 들어가서두 그 많은 박스가 있어두 사고한번 안치고 사장님 퇴근하실 새벽시간이면 눈치껏 가게밖으로 나가서 니집으로 들어가던 세상에서 제일 착한 웅이야 고양이별에선 설사도하지말고 건강하게 지내렴  어제 오랫만에 갔는데 그리 비비더니  언니한테 인사한거였구나 더 쓰다듬어줄걸  미안해 늦은시간에두 장례를 위해 픽업와주신 펫24 감사드립니다 ,15.0,yeojiin1982,"['#연희동', '#맥시칸', '#치킨', '#길냥이', '#고양이별', '#웅이', '#두령이', '#길천사', '#펫24', '#너와함께', '#안녕', '#연희동에']"
 첫줄안녕 ,5.0,mon_titi__,['#첫줄안녕🙋']
  양산통닭경상남도 양산시 하북면 신평강변2길 19Taste        Price          가성비 갑 옛날치킨 ,11.0,mot_cham_zi,['#양산통닭경상남도']
pikachu milk ball with no sugar added  so yum   chatime  pikachu  pokemon  drink  yummy  enak  minumankekinian  newmenu  food  chicken  cupbop  bbq  tteokbokki  snack  pineapple  foodblogger  foodphotography  yum  치킨  음료수  신메뉴  간식  好吃  小吃  饮料  珍珠  SUKAMAKANDARIPADABARANGBRANDED,17.0,rinduuut,"['#chatime', '#pikachu', '#pokemon', '#drink', '#yummy', '#enak', '#minumankekinian', '#newmenu', '#food', '#chicken', '#cupbop', '#bbq', '#tteokbokki', '#snack', '#pineapple', '#foodblogger', '#foodphotography', '#yum', '#치킨', '#음료수', '#신메뉴', '#간식', '#好吃', '#小吃', '#饮料', '#珍珠', '#SUKAMAKANDARIPADABARANGBRANDED']"
아웃닭갈릭반 양념반닭다리살로 만들어서 부드러웠고 튀김은 바삭바삭해서 맛있었다감자튀김과 떡튀김이 있어 더욱 맛있었다          아웃닭  궁동  치킨,3.0,yu_food_tour,"['#아웃닭', '#궁동', '#치킨']"
내 피그가 탈리로 채워지는 거 보니 내가 인도에 와 있기는 한가보다  여러번 탈리를 먹었는데 여기 치킨 탈리가 최고인 듯    치킨  치킨탈리  india  delhi,20.0,21th_engagement,"['#치킨', '#치킨탈리', '#india', '#delhi']"
 요리 집밥 일상 살림 홈메이드 치킨 집에서 가끔 튀겨먹는 치킨요즘치킨튀김가루 너무잘나와서튀겨먹기아주쉽다 다리와 몸통조각 가슴살은 튀기는시간이달라 구분해서 두세번 나누어 튀기면 더좋다친정서 농사지은 양상추로 샐러드도해서 같이 곁들어 먹으니꿀맛 ,18.0,hwangyy1457,"['#요리', '#집밥', '#일상', '#살림', '#홈메이드', '#치킨']"
뿌링뿌링 ,26.0,hny__22,[]
치킨 먹으려고 천천히 조금만 뛰었다 근데 교촌 맛이 갔다  우선 냉동닭이 되서 너무 닭이 맛이 없다 내가 닭을 가리는 사람이 아닌데 이건 좀 심하다 저녁먹고 또 먹는건데도 너무 모자란 느낌이 드는건 내가 많이 먹는건가 이게 양이 적은건가 하   앞으로 내돈주고 교촌 사먹을 일은 없을 것 같네  런스타그램  달리기  치킨  교촌치킨   냉동닭  안녕,18.0,jongchann628,"['#런스타그램', '#달리기', '#치킨', '#교촌치킨🍗', '#냉동닭', '#안녕']"
까먹고있다가 올리는 치킨  ,3.0,imsubin0822,['#치킨']
우리집 무릎 강아지   ,3.0,_h___s2___mi_,[]
동구에선 치킨하면 요기짓  맥켄치킨 후라이드 치킨,1.0,yuta_jm,"['#맥켄치킨', '#후라이드', '#치킨']"
최애 치킨버거 롸카두들  클래식버거  그랜파버거,40.0,bluecaramelice,"['#롸카두들', '#클래식버거', '#그랜파버거']"
 치킨,20.0,b_caeyun,['#치킨']
교통사고도 실손보험에서혜택이 된다는 걸 아시나요  교통사고로 치료받은 후상대방 보험사에서 합의금 받고 끝이 였다면  내 실손보험에서도 혜택이 가능 하다는 사실 그러므로 정밀하게 따져보시기 위해연락주시기 바랍니다 ,18.0,park_riha,[]
맛자랑 김치전 해물파전  매장에서도 인기만점  포장도 인기만점  배달도 인기만점 귀찮은 과정을 한팩에 담아 뜯고 부치기만 하면 끝  바삭바삭 맛있는 전이 완성됩니다  겨울에도 맛자랑 김치전 파전과 즐거운 캠핑 즐기시길 바라며1월 한달간 8 900원 세일 진행중입니다           아삭한 신김치와 양념 돼지고기의 만남   반죽의 절반이상을 김치와 고기 토핑으로 가득채운 리얼 김치전   550g 넉넉한 양으로 2인분 이상 든든하게   계량부터 반죽까지 한팩에  슥 뜯어 부치면 끝나는 초간단 레시피   캠핑음식  야식  간식으로 안성맞춤   20년 전통 레시피로 정직하게 만듭니다  ,57.0,matjarang_food,[]
 바른치킨  바른치킨의바른생활  바른치킨대전용운점  대전용운동  맛집추천  실번제치킨  58치킨  치킨  치맥  치소  먹방  맛집  맛집스타그램  대전용운맛집  골든티켓  깨끗한기름  깨끗한치킨  맛스타그램  먹스타그램  맛있는치킨  먹스타맞팔  팔로우,11.0,barun_yongun58,"['#바른치킨', '#바른치킨의바른생활', '#바른치킨대전용운점', '#대전용운동', '#맛집추천', '#실번제치킨', '#58치킨', '#치킨', '#치맥', '#치소', '#먹방', '#맛집', '#맛집스타그램', '#대전용운맛집', '#골든티켓', '#깨끗한기름', '#깨끗한치킨', '#맛스타그램', '#먹스타그램', '#맛있는치킨', '#먹스타맞팔', '#팔로우']"
 치킨 닭다리살구이,1.0,royu_home,"['#치킨', '#닭다리살구이']"
굽네 치킨              다들 치킨 좋아해 ,47.0,junie._.768,[]
