Contents,Like,ID,Tags
갓성비 넘치는 완벽한인생 남해본점이 짱이다 진짜가성비를 엄청나게 따지는 나의 마음에 쏙 들어버렸으니 말이양 매번 갈때마다 엄청나게 주문해서 거의 다 먹고 오는듯 나의 사랑임ㅜㅜㅜ덕분에 내 배는 완전 빵빵ㅋㅋㅋㅋ진짜 완전 추천합니다  한번 꼭 가보세요  완벽한인생남해본점       치킨  버거  남해맛집  스테이크  독일마을맛집  남해맛집완벽한인생  경남맛집  바베큐  피자맛집  남해맛집추천  피자  피맥  슈니첼,3.0,iteho73,"['#완벽한인생남해본점', '#치킨', '#버거', '#남해맛집', '#스테이크', '#독일마을맛집', '#남해맛집완벽한인생', '#경남맛집', '#바베큐', '#피자맛집', '#남해맛집추천', '#피자', '#피맥', '#슈니첼']"
 일상  야식  치킨저녁에 보면 못 참지,3.0,nickel_59,"['#일상', '#야식', '#치킨저녁에']"
 마산 회원구 양덕동 술집 치킨 맛집투어 맛집탐방 상호명 통닭1782 치킨은 심플하게 최고 옛날통닭  순살양념,17.0,re.tion,"['#마산', '#회원구', '#양덕동', '#술집', '#치킨', '#맛집투어', '#맛집탐방', '#통닭1782*치킨은', '#옛날통닭', '#순살양념']"
치킨은 소금구이지 치킨  소금구이,0.0,hakite01,"['#치킨', '#소금구이']"
오늘 저녁 치킨 먹을까 치킨  반반치킨,0.0,alqnvl2001,"['#치킨', '#반반치킨']"
 로제복희떡  복희떡  차돌복희떡  모둠복희떡  홍콩파복희떡  옥수스복희떡  순대볶음  튀김  치킨  순대,29.0,yang.chuljin,"['#로제복희떡', '#복희떡', '#차돌복희떡', '#모둠복희떡', '#홍콩파복희떡', '#옥수스복희떡', '#순대볶음', '#튀김', '#치킨', '#순대']"
 치킨 닥스훈트일상  개딸랑구 개린이일상  침고여 엄마가 아픈 후론치킨 간만이제 만다야부담스러워서는ㅜㅜ세상 눈똘망은올만이네저렇게 똘망진 눈동자였구나울딸,1.0,bagmiri1396,"['#치킨', '#닥스훈트일상', '#개딸랑구', '#개린이일상', '#침고여']"
  2023년  1월8  일   해장은  짜장면  짬뽕 미친듯이 배고팟는데 세젓갈먹으니         대게 먹자고 난리인걸 17만원쓸순없으니         치킨 으로 타협   오랜만에  지코바치킨     당일     새벽7시까지 먹었는데 또알콜    치맥 9  일     가장의무게 라며  야간  출근 하시는 영파파 ٩ ๑ ᴗ ๑ ۶    요리 하는데 도시가스점검 오셔서 넘나 놀래서 안절부절 했는데 넘모나 친절하셨    주부체험 ㅋㅋㅋㅋㅋ     오늘도  도전정신  고추장볶음  카레  김치찌개  감자조림 4   종류 도전했지만 카레만  성공    카레 진짜 존맛탱     케찹넣고  스튜 같이 했는데 요건 인정받았따      나머진  음쓰 행 이것찌      백쌤 이 있는한 요리는 계속된다    성공하는 그날까지    백종원의요리비책  일  영호아파서 야간반차쓰고 와서  숭늉 해달라는데 나레기      근데  밥솥 기능에  누룽지 가 있단다        일단 했는데 넘모 신기하다 ㅋㅋㅋㅋㅋ   죽으로 먹고싶대서 해줬는데 국물이 필요하단다   이렇게 하는게 아닐텐데 라고 했지만 꿋꿋히 자기가 해본단다 ㅋㅋㅋㅋㅋㅋ 결국은 맛없다함 자기가해서 그른지 꾸역꾸역먹던데   아프긴 한지 아파도 절때  병원 안가는애가 갔다오더니  아무이상없덴다  웃프다 ㅋㅋㅋㅋㅋ    삼계탕 먹으로 가주ㅜ야게따    ,8.0,haneul2323,"['#2023년', '#1월8️⃣일', '#짜장면', '#짬뽕', '#대게', '#치킨', '#지코바치킨', '#치맥', '#가장의무게', '#야간', '#출근', '#요리', '#주부체험', '#도전정신', '#고추장볶음', '#카레', '#김치찌개', '#감자조림', '#성공', '#스튜', '#음쓰', '#백쌤', '#백종원의요리비책', '#숭늉', '#밥솥', '#누룽지', '#병원', '#웃프다', '#삼계탕']"
무엇보다 통장잔고가 늘어나는 시기이길 바랄께요   ,0.0,we1kj2,[]
푸라닭 한번 시킨 이후 푸라닭만 시키라는 엄마  푸라닭  블랙알리오  투움바치킨  기름떡볶이,148.0,hufflepuff_raeng,"['#푸라닭', '#블랙알리오', '#투움바치킨', '#기름떡볶이']"
타코마요에도 재료를 아끼지않는다네 돈받고 드리는음식은 돈값을해야한다네 부산  부산맛집  치킨  치킨추천  소통  부산명지맛집  부산명지  부산신호동  신호동맛집  부산신호동맛집  치킨의길  호식이두마리치킨  타코마요치킨  매운간장,1.0,hosigi9282,"['#부산', '#부산맛집', '#치킨', '#치킨추천', '#소통', '#부산명지맛집', '#부산명지', '#부산신호동', '#신호동맛집', '#부산신호동맛집', '#치킨의길', '#호식이두마리치킨', '#타코마요치킨', '#매운간장']"
  부암동  계열사북악산행 마무리는  치킨ㆍ 부암동맛집  북악산맛집  인왕산맛집  치킨맛집  부암동치킨  모닝와이드맛집 수요미식회  수요미식회치킨  수요미식회맛집 유퀴즈맛집  유퀴즈온더블럭  유퀴즈온더블럭맛집 생활의달인  생활의달인맛집  생방송투데이 생방송투데이맛집  생방송오늘저녁맛집  테로  테로맛집  테이스티로드맛집  vj특공대맛집 먹스타그램  존맛탱  존맛  jmt,20.0,0rtho_deok_,"['#부암동', '#계열사북악산행', '#치킨ㆍ', '#부암동맛집', '#북악산맛집', '#인왕산맛집', '#치킨맛집', '#부암동치킨', '#모닝와이드맛집', '#수요미식회', '#수요미식회치킨', '#수요미식회맛집', '#유퀴즈맛집', '#유퀴즈온더블럭', '#유퀴즈온더블럭맛집', '#생활의달인', '#생활의달인맛집', '#생방송투데이', '#생방송투데이맛집', '#생방송오늘저녁맛집', '#테로', '#테로맛집', '#테이스티로드맛집', '#vj특공대맛집', '#먹스타그램', '#존맛탱', '#존맛', '#jmt']"
남매쿠폰추첨  추첨완료 남매카페  쿠폰  이벤트  응모  2차  당첨자발표  치킨  전달완료  감사합니당     안녕하세요 남매카페입니당            새해 복 많이 많이 받으세용   저희 남매 자주 들러주셔서 찾아주셔서 늘 감사합니다아   많은 분들이 주신 관심과 사랑   자주 찾아주시고 사랑 주신 게 쿠폰함으로도 확인이 가능할 정도였어요  ㅎㅎㅎㅎ 소중한 쿠폰들ㅠㅠ  남카를 찾아주시는 분들이 남매카페 도장 모으기에 재미를 느끼셨으면 좋겠다는 취지로 쿠폰 응모 이벤트를 시작하게 됐었죵    ㅎㅎㅎㅎ 많은 분들이 참여해 주셔서 저희도 정말 감사하고 재밌게 진행하고 있습니다     저번 추첨에는 오빠였다면 이번 추첨은 동생으로 진행이 되었다는       동생의 손기운으로   쿠폰은 총 30개 뽑아서 중복  찍다만 쿠폰  연락처 불분명 등의 쿠폰은 제외ㅠㅠ 빈자리만큼 다시 추첨 진행했습니당   남매카페 쿠폰 응모해 주셔서 감사합니댜    이번 닭의 주인이 되신     서 교  m 팀윤 원 이 민 문 성480  방 턱 이 림  류 우 박 현 한 경 전 성 845 김 준 김 지 오     요안 현차 진김 영김 수552  김 겸 강 정 이 지 김 희 최  박 우이 호정 수채 수축하드려용            추첨은 계속됩니당      다음 추첨까지 고고고     남매카페 많이 좋아해 주셔서 정말 정말 감사하고 앞으로도 편하게 찾아주세용    ㅎㅎㅎ 남매카페는 계속 달립니당         앞으로도 잘 부탁드립니다요 남카 빠샤 남카 손님 모두모두 빠샤빠샤  감사합니당                    남매카페 쿠폰 응모 이벤트   란 1  음료 주문하고 쿠폰 도장 찍기2  쿠폰 도장 다 찍기3  다 찍은 쿠폰은 서비스 음료 이용하기     아메리카노   모든 음료  총2잔 공짜 4  사용한 쿠폰에 이름과 연락처 적기5  응모함 넣기    찍다만 쿠폰은 제외됩니당    연락처는 정확히 적어주세용 ㅎㅎㅎ남카 3차 쿠폰 응모 진행 중입니당  ,62.0,nammae.cafe,"['#추첨완료', '#남매카페', '#쿠폰', '#이벤트', '#응모', '#2차', '#당첨자발표', '#치킨', '#전달완료', '#감사합니당😊', '#👍👍안녕하세요']"
  리뷰저희 가게 음식을 맛있게 드셔주셔서 정말 감사드립니다   저희에게 큰 힘이 되는 소중한 리뷰입니다  앞으로도 많은 사랑 부탁드립니다   감사합니다     팔복통닭 사직점               1980년 오픈 이래 변함 없는 노력과 장인 정신으로 당감동에서 꾸준한 사랑을 받고 있는 통닭입니다  모든 메뉴는 기성품은 일절 사용  손수 직접 만든 집 밥 같은 통닭    전통 옛날 통닭  포장  배달    영업시간   15 00   24 00  L O 23 00   전화   0507 1346 5312  찾아오시는 길   부산 동래구 사직로58번길 33 6                        팔복통닭 창업  창업문의  프렌차이즈  프렌차이즈문의 부산  부산맛집  부산통닭  부산치킨  부산치맥 거제  거제맛집  거제통닭  거제치킨  거제치맥 사직  사직맛집  사직통닭  사직치킨  사직치맥 통닭  치킨  치맥 먹스타  인스타 리얼리뷰  후기  내돈내산,6.0,palbok_chicken,"['#리뷰저희', '#팔복통닭', '#창업', '#창업문의', '#프렌차이즈', '#프렌차이즈문의', '#부산', '#부산맛집', '#부산통닭', '#부산치킨', '#부산치맥', '#거제', '#거제맛집', '#거제통닭', '#거제치킨', '#거제치맥', '#사직', '#사직맛집', '#사직통닭', '#사직치킨', '#사직치맥', '#통닭', '#치킨', '#치맥', '#먹스타', '#인스타', '#리얼리뷰', '#후기', '#내돈내산']"
 옥천  옥천군  옥천맛집  치킨  치느님  떡볶이  국물떡볶이  로제떡볶이  맛스타그램  맛집  먹스타스램  먹방  혼밥  야식  치킨플러스  치킨플러스옥천점,20.0,okcplus,"['#옥천', '#옥천군', '#옥천맛집', '#치킨', '#치느님', '#떡볶이', '#국물떡볶이', '#로제떡볶이', '#맛스타그램', '#맛집', '#먹스타스램', '#먹방', '#혼밥', '#야식', '#치킨플러스', '#치킨플러스옥천점']"
배달음식 시켜서 먹었던 하루   치킨  보쌈  먹팔  먹태,23.0,danda_n1224,"['#치킨', '#보쌈', '#먹팔', '#먹태']"
한국과 독일 동시 출시  에셈베 베를린 리슬링  2018 와인 치킨 페어링 페스티벌 3관왕 Asia Wine Trophy  금메달 오늘은 독특한 수상 이력이 있는 리슬링이 새로 왔답니다   베를린리슬링 은 30년 이상 독일 모젤 와인 협회장을 역임한 아돌프 슈미츠와 베를린 East Side Gallery와의 협업으로 탄생한 와인이에요 라벨에  무너트릴 벽이 많다  라는 한글 문구가 단연 눈에 가장 먼저 띠지 않을 수 없는데요  이는 당시 분단국가인 나라가 독일과 한국밖에 없었기에 평화를 갈망한다는 의미를 담은 것으로  한국과 독일에서 동시 출시되었답니다    제품명   에셈베 베를린 리슬링   원산지   독일   품종   리슬링당도      산도        바디    타닌   테이스팅노트산뜻한 시트러스와 달콤한 복숭아향이 이어지며 적당한 산도와 단미가 기분 좋게 만들어주는 편히 마시기 좋은 와인이에요    디저트  샐러드  스시  치킨  튀김요리 등과 함께 드셔보세요  일만와인상회DM  매장 전화or문자 문의 환영합니다  와인샵 와인매장 범계와인 평촌와인 안양와인 와인선물 와인추천 바틀샵 와인 네추럴와인 네추럴와인샵 선물용와인 독일와인 모젤 독일리슬링 에셈베 에셈베베를린 리슬링와인 화이트와인 치킨 리슬링,15.0,wia10000wine,"['#베를린리슬링', '#테이스팅노트산뜻한', '#일만와인상회DM', '#와인샵', '#와인매장', '#범계와인', '#평촌와인', '#안양와인', '#와인선물', '#와인추천', '#바틀샵', '#와인', '#네추럴와인', '#네추럴와인샵', '#선물용와인', '#독일와인', '#모젤', '#독일리슬링', '#에셈베', '#에셈베베를린', '#리슬링와인', '#화이트와인', '#치킨', '#리슬링']"
 행운 가득 bhc 폭 주머니를 찾아라     2023년 1월 레드킹 폭립을 반드시 먹어야 하는 이유 바로 레드킹 폭립 영수증 인증하면새해에 가장 받고 싶은 복주머니 경품을폭  폭    받을 수 있기 때문이지   재물복  건강복  먹을복 올해 가장 받고 싶은 복이 뭐야   bhc 공식 홈페이지에 들어가서내가 받고 싶은 복주머니를 고른 후영수증을 제출하고 푸짐 한 경품을 받자   bhc_chicken_official 프로필 링크 고고     경품  토끼 골드바 1돈  매주 1명 추첨   마사지건  매주 3명 추첨   레드킹 폭립 기프티콘  매주 10명 추첨    이벤트는 총 3주간 진행되고 2023년 1월 한달간 구매한 레드킹 폭립 영수증이라면모두 모두 응모 가능하니 나만의 올해 운세를 점쳐봐      이벤트 일정 1주차  1 10 화  1 16 월  당첨자 발표 1 18 수  2주차  1 17 화  1 23 월  당첨자 발표 1 25 수  3주차  1 24 화  1 31 화  당첨자 발표 2 2 목    유의사항   당첨자 발표는 bhc 공식 홈페이지에서 진행하며  경품 안내는 개별 연락드릴 예정입니다   경품 수령 시 5만원을 초과할 경우 경품의 제세공과금  22  은 당첨자가 부담합니다   BHC  치킨  BHC치킨  치킨은bhc bhc신메뉴  레드킹폭립  bhc이벤트,42.0,bhc_chicken_official,"['#BHC', '#치킨', '#BHC치킨', '#치킨은bhc', '#bhc신메뉴', '#레드킹폭립', '#bhc이벤트']"
경기 가평에 위치한  페리카나 가평역전점  바이브맛봉 설치하셨습니다 바이브맛봉은 튀김기에 설치하는 제품으로  몇시간에 걸쳐 대공사로 설치하는것이 아닌 간편하게 설치하고 쉽게 빼놓을 수도 있습니다 편안하게 설치하시고 바이브맛봉을 통해 다양한 효과를 경험해 보세요   바이브맛봉  바이브도시  페리카나  가평맛집  맛집  치킨  튀김  튀김기  환경  위생  건강  모두컴바인,1.0,jumodukeombain,"['#바이브맛봉', '#바이브도시', '#페리카나', '#가평맛집', '#맛집', '#치킨', '#튀김', '#튀김기', '#환경', '#위생', '#건강', '#모두컴바인']"
부드럽고 쫄깃한 닭다리살로 만든 닭튀김 치킨과는 다른 매력이 있답니다   류몽민 닭다리살 실제 후기1  꿔바로우와 닭강정의 중간 맛을 조화롭게 느낄 수 있어요 2  치킨하고 비슷한 비쥬얼인데  훨씬 쫀득하고 맛있어요  맥주랑 찰떡인 음식입니다 3  겉바속초의 끝  치킨보다 훨 맛있어요 치킨같지만 치킨보다 맛있는 류몽민의 시그니처 서브메뉴 닭갈비와 함께 야무지게 드셔보세요   강남 맛집 류몽민을 집에서도 즐길 수 있어요    류몽민 밀키트 구매하는 방법  ryumokmin 프로필 하단 링크에서 쉽게 구매하실 수 있습니다  류몽민  직화닭갈비,46.0,ryumokmin,"['#류몽민', '#직화닭갈비']"
대전 유성에 위치한  호식이두마리치킨 관평점  바이브맛봉 설치하셨습니다 바이브맛봉은 유증으로부터 종사자의 건강을 지켜주는 제품입니다  무료체험도 가능하니 한번 설치해보시고 효과를 느껴보세요  바이브맛봉  바이브도시  호식이두마리치킨  대전맛집  맛집  치킨  튀김  튀김기  호식이  위생  건강  환경  모두컴바인,3.0,jumodukeombain,"['#바이브맛봉', '#바이브도시', '#호식이두마리치킨', '#대전맛집', '#맛집', '#치킨', '#튀김', '#튀김기', '#호식이', '#위생', '#건강', '#환경', '#모두컴바인']"
치킨 양념 매력적이였음   치킨  치킨추천  치킨사냥  맛집,3.0,yoonseo____o,"['#치킨', '#치킨추천', '#치킨사냥', '#맛집']"
 MBTI유형별 회사생활은 어떤 모습일깡  에디터의 MBTI   ENFJㅎ 이거정말 TMI    솔직히 비슷해서 너무 놀람ㄷㄷ      o  재미로 한번 봐보장  ﾟ ﾟ  결과가 아쥬 흥미진진    이거봐방ㅋㅋㅋㅋㅋ 딱 너임ㅋㅋㅋㅋ  치킨  일상  성격유형검사  MBTI유형  먹방  MBTI연애  ENFP특징  데일리  셀스타그램  ISFP특징  맛집스타그램  ISFJ특징  술게임  INFP특징  MBTI이상형  MBTI특징  유머스타그램  소통  술  서울맛집  치킨추천  치킨맛집  치킨스타그램  대구맛집  럽스타그램  땅땅치킨  연애  팔로우  성격테스트  심리테스트,5.0,tangtangck_official,"['#치킨', '#일상', '#성격유형검사', '#MBTI유형', '#먹방', '#MBTI연애', '#ENFP특징', '#데일리', '#셀스타그램', '#ISFP특징', '#맛집스타그램', '#ISFJ특징', '#술게임', '#INFP특징', '#MBTI이상형', '#MBTI특징', '#유머스타그램', '#소통', '#술', '#서울맛집', '#치킨추천', '#치킨맛집', '#치킨스타그램', '#대구맛집', '#럽스타그램', '#땅땅치킨', '#연애', '#팔로우', '#성격테스트', '#심리테스트']"
 완벽한인생남해본점세상 맛있는 메뉴가 한가득 있는 완벽한인생 남해본점 오늘 다녀왔어요 진짜 요즘 다이어트중이라 조금만 먹으려고 했는데  막상 음식이 나오니까그 생각은 전부 잊어버렸어요ㅜㅜㅜ어찌나 영롱하던지ㅜㅜ진짜 보는것만으로도 군침이 절로 돌더라니까요ㅜㅜ당연히 맛은 말이 필요없는 맛 정말 둘이먹다 하나가 죽어도 모르겠더라구요ㅋㅋ인친님들도 한번 가보세요  여기 진짜 맛있어요      치킨  버거  남해맛집  스테이크  독일마을맛집  남해맛집완벽한인생  경남맛집  바베큐  피자맛집  남해맛집추천  피자  피맥  슈니첼,2.0,tat_jin_again,"['#완벽한인생남해본점세상', '#치킨', '#버거', '#남해맛집', '#스테이크', '#독일마을맛집', '#남해맛집완벽한인생', '#경남맛집', '#바베큐', '#피자맛집', '#남해맛집추천', '#피자', '#피맥', '#슈니첼']"
오늘 야식은 뭐먹을래    치킨  이벤트오늘 야식은 무슨 치킨으로할지아직 못정했다면  60계 사다리타기를 해봐요 ദ   ᵕ     옆으로 쭉쭉 넘겨보기       특별히 오늘만은 야식 허락해드릴게요  이벤트 상품   간지치킨 모바일 쿠폰 당첨 인원   10명 응모 기간    1월 16일 발표 일자   1월 17일  댓글로 발표  참여 방법   좋아요    무슨 치킨 나왔는지 댓글 달기   프로필 링크 응모  응모 링크   https   forms gle 2bgBCZrZsLNftojy7,1317.0,60chicken,"['#치킨', '#이벤트오늘']"
Chan Chan  Irvine  CA    small Chan Chan tenders  24 99Was in  irvine and found  chanchan on  yelp and wanted to give them a try  First  when going to  chanchanirvine it s best to go with friends  Me being on my break it s a solo date and got a small order of  chickentenders is really an order of 3  The Chan Chan sauce is like a heavy soy sauce with a hint of  jalapeno  imo not that tasty  The  chicken  tenders themselves reminds me of chicken style fried chicken but it s good  Besides the chicken you get some  banchan of  radish and  cabbage for a palette cleanser  Lastly  prices aren t list but place is expensive   food  foodie  foodporn  foodpic  nofilter  lunch  worklunch  instafood  instafoodie  치킨  orangecounty  theoc  oc  음식  반찬  점심  shopsmall  shoplocal  supportsmallbusiness,15.0,infinite_justice85,"['#irvine', '#chanchan', '#yelp', '#chanchanirvine', '#chickentenders', '#jalapeno', '#chicken', '#tenders', '#banchan', '#radish', '#cabbage', '#food', '#foodie', '#foodporn', '#foodpic', '#nofilter', '#lunch', '#worklunch', '#instafood', '#instafoodie', '#치킨', '#orangecounty', '#theoc', '#oc', '#음식', '#반찬', '#점심', '#shopsmall', '#shoplocal', '#supportsmallbusiness']"
서울 성북에 위차한  이춘봉인생치킨 성신여대점  바이브맛봉 설치하셨습니다 바이브맛봉은 튀김기에 설치하는 제품으로 무료 체험도 가능합니다바이브맛봉을 설치하시고 더욱 쾌적한 주방 환경을 만들어보세요  바이브맛봉  바이브도시  이춘봉인생치킨  치킨  성북맛집  맛집  치킨집  튀김  튀김기  위생  건강  환경  모두컴바인,2.0,jumodukeombain,"['#바이브맛봉', '#바이브도시', '#이춘봉인생치킨', '#치킨', '#성북맛집', '#맛집', '#치킨집', '#튀김', '#튀김기', '#위생', '#건강', '#환경', '#모두컴바인']"
올릴게없어요옿ㆍㆍㆍㆍㆍ 11년생  베라  1000cc  파닭  불닭 치킨,6.0,ju._.youne0117,"['#11년생', '#베라', '#1000cc', '#파닭', '#불닭', '#치킨']"
 리그램    tiba2mari by  get_regrammer계묘년 이벤트 여러분 2023년은 검은토끼의 해라는거 알고 계셨나요 토끼만 해도 귀여운데 색도 검은색 이거 완전 귀여움 끝판왕인듯 댓글에 귀여운 토끼 이모티콘과 먹고싶은 티바두마리치킨의 메뉴를 적어주세요   참여 방법 1  티바두마리치킨 인스타그램 팔로우하기  필수 2  귀여운 토끼 이모티콘과 먹고싶은 메뉴 적기 3    알마간  이벤트 상품 티바두마리치킨 모바일상품권 10명  메뉴 임의 선정 후 발송 일부 매장에서는 사용이 불가능할 수 있습니다  기간 및 발표 이벤트 기간   1월 9일   1월 10일 23 59 당첨자 발표   1월 11일  수   토끼 꼬리같이 동글동글한 치즈볼이 땡긴다면  주문전화 1588 6338 티바두마리  티바  치킨  배민  맛집  배달  이벤트  먹스타그램  먹스타  먹방  술스타  야식,0.0,songmija13,"['#리그램', '#티바두마리', '#티바', '#치킨', '#배민', '#맛집', '#배달', '#이벤트', '#먹스타그램', '#먹스타', '#먹방', '#술스타', '#야식']"
네네치킨 고강점  032 683 2511주방이 깨끗해야 음식도 맛있고 깨끗합니다   1월 10일 화요일 주방상태   날짜 시간 보이쥬    네네치킨고강점  고강동치킨  네네치킨  치킨  원종동치킨  치킨맛집  안전한먹거리  치킨배달  치킨추천맛집,0.0,nene_gogang2511,"['#네네치킨고강점', '#고강동치킨', '#네네치킨', '#치킨', '#원종동치킨', '#치킨맛집', '#안전한먹거리', '#치킨배달', '#치킨추천맛집']"
1800 2600 박스권 매매 몇년간은 노답  각자도생lf 호텔신라 잇츠한불 한화 cmg제약 대한뉴팜 hdc현대산업개발 롯데하이머트 대우조선해양 삼성엔지니어링 아가방 삼성증권 한진 넷마블 케이카 대성미생물 우리바이오 이연제약 주식  단타  스윙  장투  개미  매일  매매일지  수익일지  손실일지  치킨  한강  깡통  곱버스  레버리지  인버스  제발가즈아  일방적소통  갚즈아,1.0,give_me___rice,"['#각자도생lf', '#주식', '#단타', '#스윙', '#장투', '#개미', '#매일', '#매매일지', '#수익일지', '#손실일지', '#치킨', '#한강', '#깡통', '#곱버스', '#레버리지', '#인버스', '#제발가즈아', '#일방적소통', '#갚즈아']"
Salad time       With chicken of course  All the veggies are from Trader Joe s  샐러드 타임   물론 치킨도 함께  foodie  foodies  foodstagram  foodinstagram  foodiegram  homecooking  homemade  homecook  salad  chicken  healthyfood  traderjoes  traderjoesfinds  맛스타그램  먹스타그램   먹스타  샐러드  홈쿠킹  홈쿡  집밥스타그램  치킨,17.0,cutetility,"['#foodie', '#foodies', '#foodstagram', '#foodinstagram', '#foodiegram', '#homecooking', '#homemade', '#homecook', '#salad', '#chicken', '#healthyfood', '#traderjoes', '#traderjoesfinds', '#맛스타그램', '#먹스타그램🍴', '#먹스타', '#샐러드', '#홈쿠킹', '#홈쿡', '#집밥스타그램', '#치킨']"
  2023 계묘년 맞이 팔로우 이벤트   bareun_mket 팔로우  하고 게시글 좋아요  꾹  누른 뒤댓글만 남기면 참여 완료  참 쉽죠   바른마켓 팔로우하고 제품  특가할인 소식 챙겨가세요   당첨확률 올리는 꿀TIP  댓글에 친구소환 하면 확률 UP 게시물 공유하면 2배로 UPUP   이벤트 참여 기간  23  01  09  월    23  01  24  화   이벤트 경품  BHC 후라이드치킨 콜라 1 25L  5명 스타벅스 아이스 카페 아메리카노 Tall  10명   당첨자 발표  23  01  27  금  2023년에도 여러분에게 더  좋은 제품으로찾아 뵙는 바른마켓이 되겠습니다      바른마켓 을 구경하고 싶다면    프로필 링크 클릭   https   smartstore naver com smhael 바른마켓  온라인쇼핑몰  이벤트  팔로우이벤트 BHC  치킨  기프티콘  스타벅스  이벤트참여 경품  치킨세트  팔로우  좋아요  event,1.0,leehw6526,"['#특가할인', '#바른마켓', '#온라인쇼핑몰', '#이벤트', '#팔로우이벤트', '#BHC', '#치킨', '#기프티콘', '#스타벅스', '#이벤트참여', '#경품', '#치킨세트', '#팔로우', '#좋아요', '#event']"
