Contents,Like,ID,Tags
 협찬 교촌의 또다른 역작 블랙시크릿콤보입니다 치킨 브랜드 최강자인 교촌에서 역대급 신메뉴를출시했어요  교촌 시그니처인 허니콤보  레드콤보 교촌콤보의 맛있는 맛만 쏘옥 합쳐버린 치킨이에요 사장님귀는 당나귀에도 PPL로 나왔던데 다들 얼마나 맛있게 드시던지   저도 모르게 홀린듯이 배민 어플을 키고 주문해버렸잖아요      허니콤보의 달달함  교촌콤보의 짭짤함  레드콤보의매콤함에 오향까지 합쳤더니 중독성 갑이잖아요  맛있는 맛만 모아놨는데 맛이 없을리가 있나요  포테이토앤칩스 달달짭짤하니 완전 맥주안주로찰떡이에요  점보팩이라 양도 어마어마 ㄷㄷ  블랙시크릿콤보  23 000  포테이토앤칩스 점보팩  6 000 교촌 kyochon_official  교촌  교촌치킨  블랙시크릿치킨  치킨  chicken  신메뉴  치킨추천  야식  야식추천  치킨맛집  안산맛집  안산중앙동맛집  안산고잔동맛집  foodporn,777.0,muck_mimi,"['#협찬', '#교촌', '#교촌치킨', '#블랙시크릿치킨', '#치킨', '#chicken', '#신메뉴', '#치킨추천', '#야식', '#야식추천', '#치킨맛집', '#안산맛집', '#안산중앙동맛집', '#안산고잔동맛집', '#foodporn']"
치킨성애자들 주목 치킨덕후로서 브랜드별 인생치킨 선별하여주문했을때 실패 없을 메뉴들을 알려드립니다    치킨  치킨추천  치킨매니아  치킨맛집  치킨먹방  치킨스타그램  치킨치킨  치킨   치킨이닭  치킨은사랑입니다  치킨은언제나옳다  치킨배달  치킨은  치킨그램  치킨이닭  치킨집  치킨은살안쪄요  치킨먹는날 1   교촌치킨 블랙시크릿교촌치킨의 또하나의 역작  배달비때문에 괘씸해서 한때 불매를 했지만  대체품이 없어 어쩔수 없이 다시 먹는중  요즘 치킨은 이거만 먹음  동양의 비법양념을 담은 오향찬란 치킨이라 함  산초가루 뿌려먹으면 한마리 다먹을 수 있음  확실히 동양적인 맛 2   교촌치킨허니콤보교촌의 역작 중 하나  단짠단짠의 정점  솔직히 국내 치킨 메뉴 탑3라고 생각함 달달한 맛이 처음에 왔다가 짠맛이 확 와서 조화가 장난아님  교촌을 끊을 수 없는 이유 3   60계치킨 간지반고추반여기도 단짠단짠  하지만 60계만의 개성을 담은 맛임  간지치킨으로 단짠단짠을 내주고  고추치킨으로매콤함을 잡음 4   푸라닭 블랙마요고급치킨 푸라닭의 인기메뉴  5   처갓집 슈프림양념근본치킨인 처갓집의 필살기  양념치킨에 슈프림 소스를 마구마구 뿌려줌  6   네네치킨 스노윙반 양념반유재석이 한때 광고모델이었던 네네치킨  한때 여기만 먹었음  스노윙치킨에 양념 소스 찍어먹으면 한마리 다먹음 7   치킨플러스 꿀잼치킨신진 치킨가게인것 같은데 달콤한 맛을 사로잡음  젊은 연령층을 타겟팅 한듯  단거 좋아하면 시도해볼 만 함 8   지코바치킨 순살양념 치밥지코바 역시 근본  튀기지 않은 숯불치킨에 비법소스를 버무려져 먹으면 한마리 뚝딱  여기에 밥비벼먹으면 밥 두공기 가능 9  bhc  뿌링클 뿌링클은 너무 유명해서   설명은 생략하겠음 ,69.0,food1manga,"['#치킨', '#치킨추천', '#치킨매니아', '#치킨맛집', '#치킨먹방', '#치킨스타그램', '#치킨치킨', '#치킨🍗', '#치킨이닭', '#치킨은사랑입니다', '#치킨은언제나옳다', '#치킨배달', '#치킨은', '#치킨그램', '#치킨이닭', '#치킨집', '#치킨은살안쪄요', '#치킨먹는날', '#교촌치킨', '#교촌치킨허니콤보교촌의', '#60계치킨', '#푸라닭', '#처갓집', '#네네치킨', '#치킨플러스', '#지코바치킨', '#bhc', '#뿌링클']"
 참스큐도두점재주도의 날씨는 참 변덕이 심한 듯 하네요맑았던 어제와 달리 꽤나 우중충 합니다  마치 오늘 저녁을 고르는 내 모습과도 흡사하네요치킨이 먹고 싶다가도 회가 먹고 싶기도 하고   그래서 찾았습니다  배가 들어오는 집 참스큐 도두점 입니다 도두항에 위치한 이 프렌차이즈 치킨집은 타 치킨집과 매우 다릅니다  테이블마다 비닐이 붙어 있는게 흡사 횟집이연상 되네요 네 맞습니다  여기 자연산 회와 치킨을 무리없이 함께 파는 그런 가게 라고 하네요방문 전 유선으로 참돔 코스를 주문하였습니다 소라  전복  톳 등 해산물을 시작으로 기름장 내음 가득한 산낙지와 새콤한 맛 좋은 골뱅이소면 그리고 문어숙회가 나오고 나면 자연산 참돔 등장 합니다 두툼하고 썰어주신 회에촉촉한 초밥과 쌈장 그리고 김과 함께 싸먹는게 꽤나 맛들어집니다  문어와 횟감을 조금 튀겨 달라고 부탁드렸습니다 꽤나 담백하고 겉바속촉한 식감이 참 좋네요마지막으로 치킨 반마리와 지리가 나옵니다 사실 치킨을 더 주문 하고 싶었지만 여기 회 코스에 치킨을 더 주문 한다는 건 인원을 더 부르거나 굉장한 대식가라는 점이겠죠 회를 파는 치킨집 재미나기도 하지만 그 구성과코스 가격도 좋아 만족도가 매우 높았습니다 또 와야겠습니다  믿기 어렵겠지만 소주를 함께 하지 못했거등요 내입맛이그래  참돔코스새트 120 000원 후라이드 치킨 15 000원 상호명  참스큐 도두점 주소  제주 제주시 도두일동 2616 13 문의  064 727 9888 제주도맛집  도두항맛집  횟집 치킨  참돔  문어숙회  산낙지 지리  배가들어오는집  자연산 맛집  춘스푼제주도  춘스푼참스큐 참스큐,325.0,choon_spoon,"['#참스큐도두점재주도의', '#내입맛이그래', '#제주도맛집', '#도두항맛집', '#횟집', '#치킨', '#참돔', '#문어숙회', '#산낙지', '#지리', '#배가들어오는집', '#자연산', '#맛집', '#춘스푼제주도', '#춘스푼참스큐', '#참스큐']"
   협찬  소떡소떡 밀어내고 이제는 치떡 시대야식 하면 가장 먼저 생각나는 치킨과 떡볶이가만났다구요  이건 도대체 안먹을수가 없는 조합이에여 _ 부산시장 스타일의 꾸덕하고 감칠맛 가득한 소스에동글동글한 구슬떡   치킨을 소스에 찍어먹어도 맛있고 그냥 숟가락으로 떡만 퍼먹어도 세상 행복 왕새우치킨은 바삭바삭한 튀김옷 안에 탱글한 새우가 있어서 누가 먹어도 좋아할 맛과 식감이에여    치킨매니아   치킨맛집  떡볶이맛집  치킨추천  떡볶이추천  배달맛집,237.0,yeony_matzipsa,"['#치킨맛집', '#떡볶이맛집', '#치킨추천', '#떡볶이추천', '#배달맛집']"
로제 처돌이가 메뉴 3개 시켰더니 이만원대 나왔습니댜     꽃세권만 누릴 수 있는 초갓성비 특권        꽃다운주점   이미 알만한 사람들은 다   아는 갓성비 안주맛집   꽃주점 로제가 그러캐 마싯다구 들어서 마라탕 치새퐁에로제새우가라아게 2인분 주문했는데 전부 가격이믿기지 않을 정도로 넘 넘 넘 마싯셔요 ㅠ ㅠ ㅠ특히 로제가 ㄹㅇ 짱맛 요미가 넘 좋아하는 꾸덕소스임댜    마라탕은 고기천국    치새퐁은 치즈천국        입가심으로 투게더와플 꼭 먹키  투게더볼 짱 크구 ㄴ 재료 절대 안 아낌  어떻게 다들 이 가격에 이 맛이 나지            술자리 지갑지킴이         저장필수    투게더와플 로제새우가라아게 k마라우삼겹짬뽕 21 9      요미_잠실   욤픽맛집     biteofyommy,1342.0,biteofyommy,"['#꽃다운주점', '#저장필수)', '#요미_잠실']"
헐    지가 잠들어놓고    좋아요  맞팔  선팔 환영      예능  웃긴  유머  유머스타그램  웃긴짤  예능레전드  개꿀잼  꿀잼  짤방  레전드  오늘의유머  이슈  현웃  개웃  좋반  좋아요반사  맞팔해요  맞팔환영  팔로우미  치킨  포장,41.0,fjejvheba,"['#좋아요', '#맞팔', '#선팔', '#예능', '#웃긴', '#유머', '#유머스타그램', '#웃긴짤', '#예능레전드', '#개꿀잼', '#꿀잼', '#짤방', '#레전드', '#오늘의유머', '#이슈', '#현웃', '#개웃', '#좋반', '#좋아요반사', '#맞팔해요', '#맞팔환영', '#팔로우미', '#치킨', '#포장']"
입맛을 돋게 만들어주는 신선하고 질 좋은 닭 요리 와룡동닭매운탕 에 방문하고 왔습니다 밑반찬부터 모든 요리를 모두 수제로 직접 만들고 생닭을 직접 조리해 육즙과 신선함을느낄 수 있는 참한 닭 요리 전문점입니다  한입을 맛보는 순간 입에 감칠맛과 풍미가 퍼져침샘이 고장 나게 만들고 술안주로도 정말 좋아근처 회사원들에게 인기가 많다고 합니다  최고급 식재료로 계절에 맞춰 밑반찬도 매일 바뀌어음식에 진심과 정성을 다하는 게 느껴졌습니다   종로맛집  안국역맛집  종각맛집  인사동맛집  서순라길맛집  서울맛집,187.0,starcra_food,"['#와룡동닭매운탕', '#종로맛집', '#안국역맛집', '#종각맛집', '#인사동맛집', '#서순라길맛집', '#서울맛집']"
엊그제 졸업하고 벌써 친구들이 그리운지중딩 졸업생 오빠들 파자마 파뤼한다고 저희집에 놀러왔어요  많이 커야 할 오빠들 잘 먹어야 하니  두툼한 목살 8덩이 굽고 소스 만들어 목살스테이크 교촌 허니콤보  오리지날콤보 치즈오븐스파게티  딴짓하다 태워먹고  생크림 우유 들깨가루 넣어 크림파스타 만들었어요  크림파스타에는 들깨가루 좀 넣어서 만들어 보세요  은근 궁합이   고소하니 정말 맛나요    사는법을 아는 오빠들 아주 폭풍칭찬을 해주시네요    아휴   푹풍칭찬에 저 하늘 끝까지 올라갔다 왔지 뭐예요 ㅎㅎ 맛나게 먹어주는 오빠들 덕분에 하루종일 요리한 피곤이 싹 날아갑니다 친구들과 이렇게 우정을 쌓아가는 모습을 보면 예전 제 모습이 떠오르기도 하네요자식들 추억과 제 추억이 공유되는 느낌이랄까요  이젠 상전님 얼굴에 웃음만 가득해도 행복한게 부모의 마음일까 싶습니다다들 즐거운 저녁되세요 요미녀 떡볶이는 내일 오전 10시에 만나요     맛스타그램  쩡_밥상  집밥  집밥메뉴  저녁  손님초대요리  줌마그램  코지타벨리니  아들맘  일상  목살스테이크  홈스토랑  밥상  가정식  치킨  요리하는여자  파스타  횸쿡  요리스타그램  음식  요리  손님초대,3.0,jjung4800000,"['#맛스타그램', '#쩡_밥상', '#집밥', '#집밥메뉴', '#저녁', '#손님초대요리', '#줌마그램', '#코지타벨리니', '#아들맘', '#일상', '#목살스테이크', '#홈스토랑', '#밥상', '#가정식', '#치킨', '#요리하는여자', '#파스타', '#횸쿡', '#요리스타그램', '#음식', '#요리', '#손님초대']"
저럴거면 순살을 먹지    개그  육아소통  웃긴썰  의정부  노원  태릉  종로  군자  쨈둘  공감짤  일상공유  선팔  맞팔  선팔해요  좋튀  좋테  좋반  소통  팔로우  댓글환영  좋아요  좋아요그램  일상스타그램  이슈  일상  일상그램  일상소통  치킨  아까워  난리,55.0,happy_heaven22,"['#개그', '#육아소통', '#웃긴썰', '#의정부', '#노원', '#태릉', '#종로', '#군자', '#쨈둘', '#공감짤', '#일상공유', '#선팔', '#맞팔', '#선팔해요', '#좋튀', '#좋테', '#좋반', '#소통', '#팔로우', '#댓글환영', '#좋아요', '#좋아요그램', '#일상스타그램', '#이슈', '#일상', '#일상그램', '#일상소통', '#치킨', '#아까워', '#난리']"
아들생일  직장으로 따로 자취하는 셋째집에 자주 못오는데시간내어 잠시 들렀네요 아들이 좋아하는 한우안심스테이크와 잡채로 급 점심 생일상 차려 줬어요 점심시간이라 가족모두 함께 못하고 우리끼리 오붓하게    아들 생일 축하해       아들  생일 아들생일  생일상 한우안심스테이크 미역국  잡채  치킨 메론 집밥  홈쿡  맛집 먹스타그램  맛스타그램 푸드스타그램  맛있다그램,14.0,cook.hyang,"['#아들', '#생일', '#아들생일', '#생일상', '#한우안심스테이크', '#미역국', '#잡채', '#치킨', '#메론', '#집밥', '#홈쿡', '#맛집', '#먹스타그램', '#맛스타그램', '#푸드스타그램', '#맛있다그램']"
 치킨 장작구이 계류관 신당동 담백한맛 1인1닭,0.0,signoreyoon,"['#치킨', '#장작구이', '#계류관', '#신당동', '#담백한맛', '#1인1닭']"
  오늘의흑당 아빠 왔다  씬나씬나  아빠 손엔 치킨뿐이였지만 그래도 아빠가 와서 조아  엄빠는 맛있게  치킨 먹구양심있음 나  간식 주세요 ,3.0,blacksugar_220919,"['#오늘의흑당', '#아빠', '#치킨', '#간식']"
뿅감  결론은 치킨과 부대찌개       메타포션  메타포션커피플랜트  metapotion  메타보이  metaboy  메타보이라방  라이브방송  라방맛집  라방소통  뿅감  치킨  부대찌개  감말랭이,0.0,metapotion,"['#메타포션', '#메타포션커피플랜트', '#metapotion', '#메타보이', '#metaboy', '#메타보이라방', '#라이브방송', '#라방맛집', '#라방소통', '#뿅감', '#치킨', '#부대찌개', '#감말랭이']"
 협찬  호식이 두마리치킨타코마요치킨 감자볼튀김 타피오카쫀도그 박스 열자마자 멕시칸음식 타코냄새 가득훈제 할라피뇨맛의 치폴레 양념 베이스로 감칠맛이 가득해요  바삭한 튀김 속 촉촉한 감자가 가득 감자볼 튀김  겉바속쫀의 정석  타피오카 쫀도그까지넘넘넘 든든하게 잘 먹었습니다     이벤트당첨 hosigi1999 호식이두마리치킨  타코마요치킨  치킨      치맥  치킨스타그램  안주  간식  야식  야식스타그램  맛집  맛집추천  치킨추천  간식스타그램  존맛탱  맛있다  맛도리  음식  야식추천  맥주  먹스타그램  맛스타  먹팔맞팔  먹팔환영  먹팔해요  이벤트  chicken,9.0,muksta_ssjh,"['#협찬', '#호식이두마리치킨', '#타코마요치킨', '#치킨.....', '#치맥', '#치킨스타그램', '#안주', '#간식', '#야식', '#야식스타그램', '#맛집', '#맛집추천', '#치킨추천', '#간식스타그램', '#존맛탱', '#맛있다', '#맛도리', '#음식', '#야식추천', '#맥주', '#먹스타그램', '#맛스타', '#먹팔맞팔', '#먹팔환영', '#먹팔해요', '#이벤트', '#chicken']"
  마니골뱅이  강남구 역삼동 지인 맛집으로 추천받아서 같이 방문  위치가 애매한곳에 있는데 사람들이 꽤 많았다  골뱅이집이지만 가장 유명한 치킨 크랩이랑 베이컨떡볶이 주문  치킨은 맛도리였고 떡볶이는 평범했는데 양이 엄청났음  요즘 베이비크랩튀김 파는곳이 별로 없어서 찾기힘든데 좋아한다면 방문하는걸 추천 ,1.0,life.is.soju__,[]
치킨신드롬 핫스페셜매장   치킨신드롬 용정점위치   충청북도 청주시 상당구 용정동 1122평가   핫스페셜   퇴근 후 치킨신드롬에서 핫스페셜에 맥주한잔 스페셜해집니다 맛있게 매운게 중독적인 매운맛다리   날개   떡탑으로 쌓여있는게 탑은 어느순간 순삭됩니다 떡볶이   걸죽한 국물에 매콤한 떡볶이 치킨과도 잘 어울립니다 치즈볼  맛이 없을리가 없는 치즈볼입니다  내돈내산  청주  청주맛집  치킨  치킨탑  핫스페셜  청주치킨  치킨신드롬  치킨신드롬핫스페셜  용정동치킨  용정동치킨신드롬  치킨신드롬용정점,21.0,ople_story,"['#내돈내산', '#청주', '#청주맛집', '#치킨', '#치킨탑', '#핫스페셜', '#청주치킨', '#치킨신드롬', '#치킨신드롬핫스페셜', '#용정동치킨', '#용정동치킨신드롬', '#치킨신드롬용정점']"
지난주말 동훈이 귀염둥이였네 서울 평택 안성 순천 여수 치킨 떡볶이 새로 신남 술쟁이들 소주 만취 주말 퇴근길,3.0,dlwnsgkr1,"['#서울', '#평택', '#안성', '#순천', '#여수', '#치킨', '#떡볶이', '#새로', '#신남', '#술쟁이들', '#소주', '#만취', '#주말', '#퇴근길']"
오랜만에  코보스  후라이드치킨  치킨        ,5.0,so_m_iii,"['#코보스', '#후라이드치킨', '#치킨', '#❤️❤️❤️']"
    당산  맛집  치킨  후라이드맛집  바삭바삭  감계무량,3.0,jane_0391,"['#당산', '#맛집', '#치킨', '#후라이드맛집', '#바삭바삭', '#감계무량']"
생맥주가 있는 한식뷔페 일루입니다 illu가 2023년 1월 10일 화요일에 준비하여 상 위에 올린 음식들의 손님상차림입니다 많이 홍보하고 알렸건만 아직도 많은 분들이모르고 계시네요  해서 다시한번 알려드립니다 일루에서 매일 열 분의 멋스럽고 맛스러운 상차림 사진을 찍고있습니다  무료 식사의작은행운을 드리기 위함입니다  제가 사진을찍으면 님께서도 본인 사진을 찍어주시고 당일 저녁이나 다음 날 아침에 인스타그램속 일루에서  본인 사진을 찿아보세요  그 곳에사진이 있으면 당첨되신 것이오니  점심시간에 오셔서 쥔장에게 제시하시고 무료식사 즐겨주세요 매일매일 무료식사의 작은행운을 드리는 여기는여러분들의 점심놀이터 일루입니다 ㅡ일루 퓨전한식뷔페ㅡ  테라타워2 지하1층 B동 g117호  문정동한식뷔페 문정역한식뷔페 일루한식뷔페 생맥주한식뷔페 문정동맛집 문출사메뉴 문정역맛집 문출사 치킨맛집 송파맛집 한식뷔페 테라타워2 무제한 8500원 치킨 일루 문정동 문정역 점심 맥주무한리필 생생정보 한식무한리필 kbs 치킨 생맥주 무한리필 무한리필,10.0,illu_cafeteria,"['#문정동한식뷔페', '#문정역한식뷔페', '#일루한식뷔페', '#생맥주한식뷔페', '#문정동맛집', '#문출사메뉴', '#문정역맛집', '#문출사', '#치킨맛집', '#송파맛집', '#한식뷔페', '#테라타워2', '#무제한', '#8500원', '#치킨', '#일루', '#문정동', '#문정역', '#점심', '#맥주무한리필', '#생생정보', '#한식무한리필', '#kbs', '#치킨', '#생맥주', '#무한리필', '#무한리필']"
 치킨,2.0,kebinyu9039,['#치킨']
 kfc,14.0,_sweet._.y,['#kfc']
 오늘  일상  데일리  치킨  역북동맛집  용인맛집  맛집  봉이치킨직장인들 주머니 사정을 고려해주는듯해서 맛있는  치킨맛집오늘은 근무하고 오후에 퇴근  했는데 오후부터 자서 피곤하기도 한데   잘자던 타이밍에중간중간 온 전화 2통 때문에 피곤  딱 잘자고 있을때 오네 아직 안잘때나 깰때쯤 오면 좋았을것을,3.0,a._.jin._.o,"['#오늘', '#일상', '#데일리', '#치킨', '#역북동맛집', '#용인맛집', '#맛집', '#봉이치킨직장인들', '#치킨맛집오늘은']"
   굽네치킨  야식  치킨,5.0,elliesinwonderland,"['#굽네치킨', '#야식', '#치킨']"
  CHIMAC灣仔 Wan Chai 晚餐 之前lunch買過外賣覺得味道唔錯 份量又多 價錢都唔貴今次買二人餐做晚餐 有兩款炸雞 兩個迷你飯 兩個小食 兩罐飲品 炸雞可以揀無骨雞腿肉 或者 有骨雞有原味 同 另一款自選味 各5件 不過返到屋企發覺店員有俾多  自選味揀咗蜂蜜焦糖味 甜甜地 好開胃原味就無醬汁 但都唔會驚好乾好無味雞肉都幾多幾大嚿 唔會太厚炸皮 迷你飯都唔算迷你 份量比平時屋企食嘅飯量仲要多 叫咗泡菜豬肉飯 同 韓式牛肉飯兩款都唔錯 仲有啲醬汁撈下  food__  food__Korean food__takeaway food__WanChai   치킨  치맥 맛스타그램  2023 01 09    HongKong  HK food  foodie  foodstagram  instafood  fooddiary  foodphotography  hkfood  hkig  hkblogger  hkfoodie  hkigfood  hkfoodblogger  foodiehk 美食  香港美食  맛집  인스타푸드  followforfollowback,12.0,crazy.__.cc,"['#food__🙂', '#food__Korean', '#food__takeaway', '#food__WanChai', '#치킨', '#치맥', '#맛스타그램', '#HongKong', '#HK', '#food', '#foodie', '#foodstagram', '#instafood', '#fooddiary', '#foodphotography', '#hkfood', '#hkig', '#hkblogger', '#hkfoodie', '#hkigfood', '#hkfoodblogger', '#foodiehk', '#美食', '#香港美食', '#맛집', '#인스타푸드', '#followforfollowback']"
간만의 만찬          연어회 닭발 치킨 편육 통삼겹구이,5.0,h0a3n28,"['#연어회', '#닭발', '#치킨', '#편육', '#통삼겹구이']"
燈光紅吱吱到完全拍不出食物 酸奶炸雞好吃     很冷還是要喝裝滿碎冰的奶茶啊啊啊   椒麻雞蛋飯  176  炒海鮮河粉  166  酸奶炸雞  186  菠蘿包  56  金沙西多士  102  絲襪港奶  82  捷運中山站  台北美食  中山區美食  中山站咖啡廳  daydayhappyfood  美天餐室  港式風格  高熱量高快樂  西多士  炸雞  菠蘿包  pinky吃放日記  吃放日常  減肥明天再說  吃播  台北ク ルメ  ヤムチャ  チキン  タイ式  ソータ   カフェ巡り  インスタ映え  テ イリー  타이페이맛집  치킨  디저트  카페투어  먹스타그램  인스타일상  데일리,3.0,pinnnky314,"['#台北美食', '#中山區美食', '#中山站咖啡廳', '#daydayhappyfood', '#美天餐室', '#港式風格', '#高熱量高快樂', '#西多士', '#炸雞', '#菠蘿包', '#pinky吃放日記', '#吃放日常', '#減肥明天再說', '#吃播', '#台北グルメ', '#ヤムチャ', '#チキン', '#タイ式', '#ソーダ', '#カフェ巡り', '#インスタ映え', '#デイリー', '#타이페이맛집', '#치킨', '#디저트', '#카페투어', '#먹스타그램', '#인스타일상', '#데일리']"
엄마 힘들땐 치킨시켜 전 방학도 안했는데  왜이렇게 힘들까요  하루하루 다가오는게 더 부담 오늘은 제가 먹고싶어 치킨시키자 했네요  아이는 뭐 땡땡큐죠  튀기는 순서가 적혀있는 바른치킨 오늘 주문이 꽤 많이 나갔나봐요 40번대 첨봐요  맛집소문이 났군요 부위는 윙봉으로  새우추가하고  카바사칩도 추가하고 오늘 괜히 먹는거에 진심인 엄마네요 치킨도 맛있지만  이집은 카바사칩 맛집요 한봉지 더 추가 바삭하면서 담백하고 맛깔나는게 요거 과자로는 안나오나요  치킨  저녁메뉴  바른치킨  현미와사삭  카바사칩  카바사과자  치킨맛집  충무공동맛집  진주혁신맛집  진주맛집  맛집그램  일상그램,3.0,dymom2020,"['#치킨', '#저녁메뉴', '#바른치킨', '#현미와사삭', '#카바사칩', '#카바사과자', '#치킨맛집', '#충무공동맛집', '#진주혁신맛집', '#진주맛집', '#맛집그램', '#일상그램']"
허니는 오리지날 말고 콤보로   예람세끼  예람저녁  교촌  교촌치킨  치킨  허니콤보  레드콤보  웨지감자,1.0,ye_rrrrrrrrrram_diet_,"['#예람세끼', '#예람저녁', '#교촌', '#교촌치킨', '#치킨', '#허니콤보', '#레드콤보', '#웨지감자']"
호식이는 언제나 완벽 그잡채   오독오독 씹히는 맛이 일품인 타코마요치킨거기에 이세상 쫀득함이 아닌 쫀도그파삭부드러운 감자볼튀김까지말이 필요없었돠       호식이두마리치킨  타코마요치킨  호식이신메뉴  치킨  치킨추천  감자볼튀김  쫀도그  야식  야식추천  JMT  좋아요  일상,5.0,fobbi2020,"['#호식이두마리치킨', '#타코마요치킨', '#호식이신메뉴', '#치킨', '#치킨추천', '#감자볼튀김', '#쫀도그', '#야식', '#야식추천', '#JMT', '#좋아요', '#일상']"
 꼬방꼬방매콤 달콤 숯불 양념 바베큐에 바삭 고소 치킨 파우더 향 가득후라이드 치킨은 못 참지 ,19.0,ksm_pig,['#꼬방꼬방매콤']
엽기떡볶이   치킨   햄버거 asmr  asmrsound  asmrvideos  asmrfood  asmrvids  asmrmukbang  mukbang  mukbangshow  mukbangvideo  mukbangasmr  mukbangfood  mukbangsounds  tteokbokki  chicken  hamburger  spicy  kfc  떡볶이  치킨  햄버거  치즈소스  봉길이  유튜브,3.0,love__food_33,"['#asmr', '#asmrsound', '#asmrvideos', '#asmrfood', '#asmrvids', '#asmrmukbang', '#mukbang', '#mukbangshow', '#mukbangvideo', '#mukbangasmr', '#mukbangfood', '#mukbangsounds', '#tteokbokki', '#chicken', '#hamburger', '#spicy', '#kfc', '#떡볶이', '#치킨', '#햄버거', '#치즈소스', '#봉길이', '#유튜브']"
 교촌치킨가산디지털점 교촌윙  19 000 펩시제로  3 000 교촌치킨 치킨 교촌,3.0,20160803_,"['#교촌치킨가산디지털점', '#교촌윙', '#펩시제로', '#교촌치킨', '#치킨', '#교촌']"
