Contents,Like,ID,Tags
 첫줄어제 저녁까진 친구가 보내준 선물을 먹으며행복했는데 증명사진 찍기로 한걸 잊어버렸네지난 운전면허증때 사진이 이상하게 나왔는지자꾸 본인이 맞냐고 그려셔서   이번에는 나름 괜찮은 스튜디오로 예약했다ㅎㅎ점심에 샐러드 먹었더니 일도 안되고배고파서 갤러리나 구경하는중       월요일  일상  다이어트  배고파  야식  치킨  먹방,3.0,ladolce_vita_a,"['#첫줄어제', '#월요일', '#일상', '#다이어트', '#배고파', '#야식', '#치킨', '#먹방']"
가리비찜   BBQ 후라이드치킨   처음처럼 ㆍㆍㆍㆍㆍㆍㆍㆍㆍㆍㆍㆍㆍㆍㆍㆍㆍ 가리비  가리비찜  bbq  치킨  후라이드치킨  처음처럼  먹방  먹스타그램  먹방스타그램  맛스타그램  집데이트  술  술스타그램  소주  럽스타그램  일상  일상스타그램  daily  소확행  소통  소통해요  소통환영  소통스타그램  좋아요  chicken  인친  인친환영  닭  추억  추억스타그램,27.0,m_m_yung,"['#가리비', '#가리비찜', '#bbq', '#치킨', '#후라이드치킨', '#처음처럼', '#먹방', '#먹스타그램', '#먹방스타그램', '#맛스타그램', '#집데이트', '#술', '#술스타그램', '#소주', '#럽스타그램', '#일상', '#일상스타그램', '#daily', '#소확행', '#소통', '#소통해요', '#소통환영', '#소통스타그램', '#좋아요', '#chicken', '#인친', '#인친환영', '#닭', '#추억', '#추억스타그램']"
강정이기가막혀NEW STYLE새로워진 강정을 소개합니다 강정이 기가막혀 새로워진 닭강정 메뉴는일부 매장에서 찾아뵐 수 있습니다      서울 면목점  경기고양 화정점  시흥대야점곧 다른 매장에서도 찾아뵙도록 노력하겠습니다    ,1.0,gangjung.gg,[]
 교촌  뼈없는순살  반반  간장  레드  순살은 별로여써    치킨  교촌치킨  닭  닭고기 다음부턴 늘 시켜먹던 날개봉으로 다시  돌아간다   그리고 퐁듀보단 고르곤졸라네   고르곤졸라  퐁듀  치즈볼,4.0,yong00a,"['#교촌', '#뼈없는순살', '#반반', '#간장', '#레드', '#치킨', '#교촌치킨', '#닭', '#닭고기', '#고르곤졸라', '#퐁듀', '#치즈볼']"
  성공적인 사업의 서포터가 되어 드립니다  1  소규모 외식업 창업    아이템 선정  기획  점포개발  메뉴개발    교육  운영 등 2  신규 브랜드 론칭     신규 외식 브랜드 론칭 전분야   사업 타당성 분석  브랜드 컨셉  메뉴개발    본사 수익률 기획  디자인  인테리어 컵셉   개발  매뉴얼 개발 및 교육  상권분석 및   개발  가맹사업 진행  사후관리  3  메뉴 개발   개인 및 기업 매뉴 리뉴얼 및 신규 매뉴 개발 4  각종 인허가   HACCP 및 식품 제조 허가 진행 및 사후관리    각종 문의   인스타 DM    이메일 yeol1221 nate com  카카오톡 baristasoo10   소규모창업  외식업  창업  커피  카페  디저트  베이커리  치킨  샌드위치  브런치  햅썹인증  식품제조허가  메뉴개발  신규브랜드  사업타당성  메뉴엔지니어링  메뉴원가  손익시물레이셤  샐러드  밀키트  HMR  상권조사개발  개인매장  아이템개발  교육  운영  매뉴얼개발,13.0,food_developer_raymond10,"['#소규모창업', '#외식업', '#창업', '#커피', '#카페', '#디저트', '#베이커리', '#치킨', '#샌드위치', '#브런치', '#햅썹인증', '#식품제조허가', '#메뉴개발', '#신규브랜드', '#사업타당성', '#메뉴엔지니어링', '#메뉴원가', '#손익시물레이셤', '#샐러드', '#밀키트', '#HMR', '#상권조사개발', '#개인매장', '#아이템개발', '#교육', '#운영', '#매뉴얼개발']"
 BSR 타임즈  bhc치킨  동반성장 위한  전국 가맹점 순회 간담회  개최 bhc치킨은 지난달 22년 12월  한 달간 대전충청 지역을 시작으로 제주  강원지역까지 전국 가맹점 순회 간담회를 진행했습니다  2022년 한 해 동안 동반 성장을 위해 뜻을 모아준 각 지역 가맹점 사업주들에게 감사한 마음을 전함과 동시에 현장의 목소리를 청취  향후 개선점과 발전 방안을 논의하는 시간이었는데요  뿐만 아니라 신메뉴  2022년의 경영성과 2023년도 본사의 방향성 등을 이야기하며 성장의 시간을 가졌습니다  bhc치킨 임금옥 대표는  올 한 해도 국내외 불안정한 정세와 물가 상승 등의 어려운 여건 속에서도 가맹점 사업주 여러분들의 노력 덕분에 지속적인 성장세를 보이고 있다 라고 전하며  본사 역시 원활한 재료 수급과 배송  적극적인 마케팅 등 저희와 함께하는 모든 가맹점들이 동반 성장할 수 있는 발판을 만들기 위해 계속 노력하겠다 라고 전했습니다  올 한 해 더욱 좋은 모습을 보여드리기 위해 노력하는 bhc치킨 여러분의 즐거움과 행복을 위해 올 한 해도 열심히하겠습니다     bhc_BSR  bhc치킨  BSR  bhc  BSR타임즈  가맹점  순회  간담회  성장  발전  시간  사업주  감사  개선  경영성  방향성  치킨추천  발판  마케팅  도움  행복  치킨,92.0,bhc_bsr,"['#bhc_BSR', '#bhc치킨', '#BSR', '#bhc', '#BSR타임즈', '#가맹점', '#순회', '#간담회', '#성장', '#발전', '#시간', '#사업주', '#감사', '#개선', '#경영성', '#방향성', '#치킨추천', '#발판', '#마케팅', '#도움', '#행복', '#치킨']"
 REPOST  bareun_mket with  get__repost__app   2023 계묘년 맞이 팔로우 이벤트    bareun_mket 팔로우  하고 게시글 좋아요  꾹  누른 뒤댓글만 남기면 참여 완료  참 쉽죠   바른마켓 팔로우하고 제품  특가할인 소식 챙겨가세요   당첨확률 올리는 꿀TIP  댓글에  친구소환 하면 확률 UP 게시물 공유하면 2배로 UPUP   이벤트 참여 기간  23  01  09  월    23  01  24  화   이벤트 경품  BHC 후라이드치킨 콜라 1 25L  5명 스타벅스 아이스 카페 아메리카노 Tall  10명   당첨자 발표  23  01  27  금  2023년에도 여러분에게 더  좋은 제품으로찾아 뵙는 바른마켓이 되겠습니다      바른마켓 을 구경하고 싶다면    프로필 링크 클릭   https   smartstore naver com smhael 바른마켓  온라인쇼핑몰  이벤트  팔로우이벤트 BHC  치킨  기프티콘  스타벅스  이벤트참여 경품  치킨세트  팔로우  좋아요  event  repostandroid  repostw10,0.0,ahj_1290,"['#REPOST', '#특가할인', '#바른마켓', '#온라인쇼핑몰', '#이벤트', '#팔로우이벤트', '#BHC', '#치킨', '#기프티콘', '#스타벅스', '#이벤트참여', '#경품', '#치킨세트', '#팔로우', '#좋아요', '#event', '#repostandroid', '#repostw10']"
Reposted from  bareun_mket   2023 계묘년 맞이 팔로우 이벤트    bareun_mket 팔로우  하고 게시글 좋아요  꾹  누른 뒤댓글만 남기면 참여 완료  참 쉽죠   바른마켓 팔로우하고 제품  특가할인 소식 챙겨가세요   당첨확률 올리는 꿀TIP  댓글에  친구소환 하면 확률 UP 게시물 공유하면 2배로 UPUP   이벤트 참여 기간  23  01  09  월    23  01  24  화   이벤트 경품  BHC 후라이드치킨 콜라 1 25L  5명 스타벅스 아이스 카페 아메리카노 Tall  10명   당첨자 발표  23  01  27  금  2023년에도 여러분에게 더  좋은 제품으로찾아 뵙는 바른마켓이 되겠습니다      바른마켓 을 구경하고 싶다면    프로필 링크 클릭   https   smartstore naver com smhael 바른마켓  온라인쇼핑몰  이벤트  팔로우이벤트 BHC  치킨  기프티콘  스타벅스  이벤트참여 경품  치킨세트  팔로우  좋아요  event,2.0,asoen0310,"['#특가할인', '#바른마켓', '#온라인쇼핑몰', '#이벤트', '#팔로우이벤트', '#BHC', '#치킨', '#기프티콘', '#스타벅스', '#이벤트참여', '#경품', '#치킨세트', '#팔로우', '#좋아요', '#event']"
닭강정    나의최최최애 닭  사당  다글다글 진짜 한번 맛보면 다른 닭강정에 눈돌리기는 어려운 다글다글 닭강정 원래 위에마늘후레이크였는데 아몬드로 바뀌었네요  사장님이 바뀌었나요 원래 우리집까지 배달됬는데 배달불가지역이되서 집적  포장 하러 달려갔다요    달콤하고매콤하고 18000원의 행복이랄까여  ㅎㅎ고기육즙 미치고 튀김에또한번 미치는 닭강정    누가 닭얘기만해도 다글다글 닭강정 먹어보라고 추천하고 다닐정도 ㅎㅎ기본이 약간 매워서  양배추피클이랑 먹으면 끝내줘용 다음에는 마늘강정먹어야겠어요 저는 맵찔이라서요  떡사리2천원추가인데 안하면 큰일나요    떡도 맛있거든요   ,123.0,zunii_food,"['#다글다글', '#포장']"
 bluuuooe 그치 다 똑같은 마음 카페 다이어트 냠냠 일상 데일리 주말순삭 치킨 피자 떡볶이 조합,3.0,bluuuooe,"['#카페', '#다이어트', '#냠냠', '#일상', '#데일리', '#주말순삭', '#치킨', '#피자', '#떡볶이', '#조합']"
  오늘의혼밥 집 근처에 새로 생긴 치킨집  주말에 밥맛없어서 걍 가볍게 먹을라고 시켰는데    와 뭔 닭날개가 통으로 있는것도 아니고 분할된건데 한조각이 거의 닭다리 사이즈여    솔직히 비주얼은 좀    좀    많이 그런데   튀김옷 다 벗겨져 있고 소스 떡져있고 좀 그래근데 사이즈가 참 맘에드는군한 세조각 먹었는데 배불러양념은 예상보다 많이맵고 허니갈릭은 맛있다  몇개 든 떡 고거 맛있다  혼밥  혼밥스타그램  먹스타그램  쿰척쿰척  혼밥메뉴  혼밥러  프로혼밥러  혼밥러의길  시카고  인친환영  인친해요  소통  공감  퇴근  직장인혼밥  인스타초보  치킨  치느님  양념치킨  허니갈릭치킨  닭날개  치킨윙  mymychicken  chicken  chickenwings,18.0,junkieslice.k,"['#오늘의혼밥]집', '#혼밥', '#혼밥스타그램', '#먹스타그램', '#쿰척쿰척', '#혼밥메뉴', '#혼밥러', '#프로혼밥러', '#혼밥러의길', '#시카고', '#인친환영', '#인친해요', '#소통', '#공감', '#퇴근', '#직장인혼밥', '#인스타초보', '#치킨', '#치느님', '#양념치킨', '#허니갈릭치킨', '#닭날개', '#치킨윙', '#mymychicken', '#chicken', '#chickenwings']"
경기 포천에 위치한  계혁명옛날통닭  바이브맛봉 설치하셨습니다 옛날통닭은 기름을 많이 사용하시죠  바이브맛봉은 기름이 많은 음식에 더욱 효과를 보이는 제품입니다 통닭 업주님들의 많은 관심 부탁드립니다  바이브맛봉  바이브도시  계혁명옛날통닭  옛날통닭  통닭  치킨  포천맛집  맛집  튀김  튀김기  맛  위생  건강  모두컴바인,2.0,jumodukeombain,"['#바이브맛봉', '#바이브도시', '#계혁명옛날통닭', '#옛날통닭', '#통닭', '#치킨', '#포천맛집', '#맛집', '#튀김', '#튀김기', '#맛', '#위생', '#건강', '#모두컴바인']"
2023 01 08금일 리뷰이벤트 10번 후원 참여자 입니다   감사합니닭  2023 01 후원 현황 1 4 4 000원    꼬닭이 1 000원   총 5 000원 리뷰이벤트 후원금은 매월 초에 정산하여 강동구 행복한세상복지센터로 기부됩니다  야꼬닭  야꼬닭바베큐  야꼬닭숯불바베큐  숯불구이  숯불바베큐  숯불바베큐치킨  숯불치킨  숯불양념치킨  치킨  치킨추천  치밥  저녁메뉴  저녁메뉴추천  길동배달  길동맛집  둔촌동맛집  야꼬닭강동구점  강동배달  강동구배달  둔촌동배달  배달의민족  요기요  땡겨요  쿠팡이츠  위메프오배달  야식  야식추천  야식스타그램  천호맛집  천호배달맛집,3.0,yakodak_gangdong,"['#야꼬닭', '#야꼬닭바베큐', '#야꼬닭숯불바베큐', '#숯불구이', '#숯불바베큐', '#숯불바베큐치킨', '#숯불치킨', '#숯불양념치킨', '#치킨', '#치킨추천', '#치밥', '#저녁메뉴', '#저녁메뉴추천', '#길동배달', '#길동맛집', '#둔촌동맛집', '#야꼬닭강동구점', '#강동배달', '#강동구배달', '#둔촌동배달', '#배달의민족', '#요기요', '#땡겨요', '#쿠팡이츠', '#위메프오배달', '#야식', '#야식추천', '#야식스타그램', '#천호맛집', '#천호배달맛집']"
육아휴가 시작             첫옹알이  잘자라는구만  딸바보  승원이생일  축하파티  삼겹살김치찜  탕수육  쟁반짜장  치킨  술  7시간술마시기,101.0,the_west_sea_jjang,"['#첫옹알이', '#잘자라는구만', '#딸바보', '#승원이생일', '#축하파티', '#삼겹살김치찜', '#탕수육', '#쟁반짜장', '#치킨', '#술', '#7시간술마시기']"
 food  delicious  potato  fried  chicken  shake  icecream  yummy  happy  family  daily  memories  macdonalds  dessert  맛스타그램  맛있다  감자튀김  치킨  쉐이크  자두  아이스크림  맥도날드  일상  행복  간식  소확행    맥도날드에 햄버거 먹으러 가는 일 보단 아이들이 좋아하는 간식 먹으러 가게 된다  짭쪼롬한 감자튀김과 매콤 한 치킨  달달한 아이스크림과 자두 쉐이크   냠냠   햄버거 먹는 거 보다 돈이 더 나온다   ,8.0,lovely_twins_yoonvely_papa,"['#food', '#delicious', '#potato', '#fried', '#chicken', '#shake', '#icecream', '#yummy', '#happy', '#family', '#daily', '#memories', '#macdonalds', '#dessert', '#맛스타그램', '#맛있다', '#감자튀김', '#치킨', '#쉐이크', '#자두', '#아이스크림', '#맥도날드', '#일상', '#행복', '#간식', '#소확행']"
 조개찜 치킨 조개탕 조개를품은닭 포항맛집 포항송도맛집,29.0,leejina_85,"['#조개찜', '#치킨', '#조개탕', '#조개를품은닭', '#포항맛집', '#포항송도맛집']"
1 9일  월요일맛있는 치킨버섯일식카레가 준비되었습니다 사과와 양파 꿀을 베이스로한 일본식카레에 순살치킨과 느타리버섯을 오븐에 구워 고명으로 얹었습니다  맵지 않아요    식탁_치킨버섯일식카레  카레  커리  카레맛집  치킨  버섯  치킨버섯카레  치킨버섯일식카레  일본식카레  식탁곁들임  식탁곁드림  식탁곁들임메뉴  반찬  반찬가게  반찬가게맛집  반찬가게창업  맛집  은평구반찬  응암동반찬  녹번역반찬  응암동반찬가게  녹번역  녹번역e편한세상캐슬  녹번역이편한세상캐슬  녹이캐  배달  sbs생방송투데이  테이블사이드디쉬,8.0,table.side.dish,"['#식탁_치킨버섯일식카레', '#카레', '#커리', '#카레맛집', '#치킨', '#버섯', '#치킨버섯카레', '#치킨버섯일식카레', '#일본식카레', '#식탁곁들임', '#식탁곁드림', '#식탁곁들임메뉴', '#반찬', '#반찬가게', '#반찬가게맛집', '#반찬가게창업', '#맛집', '#은평구반찬', '#응암동반찬', '#녹번역반찬', '#응암동반찬가게', '#녹번역', '#녹번역e편한세상캐슬', '#녹번역이편한세상캐슬', '#녹이캐', '#배달', '#sbs생방송투데이', '#테이블사이드디쉬']"
1 9일  월요일맛있는 치킨버섯일식카레가 준비되었습니다 사과와 양파 꿀을 베이스로한 일본식카레에 순살치킨과 느타리버섯을 오븐에 구워 고명으로 얹었습니다  맵지 않아요    식탁_치킨버섯일식카레  카레  커리  카레맛집  치킨  버섯  치킨버섯카레  치킨버섯일식카레  일본식카레  식탁곁들임  식탁곁드림  식탁곁들임메뉴  반찬  반찬가게  반찬가게맛집  반찬가게창업  맛집  지축역반찬  지축동반찬  지축동반찬가게  지축역  지축역센트럴푸르지오  e편한세상지축센텀가든  지축역북한산유보라  지축역한림풀에버  지축나인포레  지축역중흥s클래스북한산파크뷰  sbs생방송투데이  테이블사이드디쉬,3.0,table_side_dish2,"['#식탁_치킨버섯일식카레', '#카레', '#커리', '#카레맛집', '#치킨', '#버섯', '#치킨버섯카레', '#치킨버섯일식카레', '#일본식카레', '#식탁곁들임', '#식탁곁드림', '#식탁곁들임메뉴', '#반찬', '#반찬가게', '#반찬가게맛집', '#반찬가게창업', '#맛집', '#지축역반찬', '#지축동반찬', '#지축동반찬가게', '#지축역', '#지축역센트럴푸르지오', '#e편한세상지축센텀가든', '#지축역북한산유보라', '#지축역한림풀에버', '#지축나인포레', '#지축역중흥s클래스북한산파크뷰', '#sbs생방송투데이', '#테이블사이드디쉬']"
이런 사랑스러운 눈빛으로 처다보면안줄수가 없잖아     한입 크기로 많이 들어있으니 조금 더 주어도 된다개  아삭아삭  치킨트릿 과 함께 간식타임 하자개     트릿테이블  동결건조  치킨음성듣기번역하기언어전환영어If you look at me with these lovely eyes I can t help but give it to you     There are a lot of bite sized ones You can give me some more Oh  my With  Chicken Tree  Let s have snack time  Trittable  Frozen  Chicken,35.0,dogttfood,"['#치킨트릿', '#간식타임', '#트릿테이블', '#동결건조', '#치킨음성듣기번역하기언어전환영어If', '#Chicken', ""#Let's"", '#Trittable', '#Frozen', '#Chicken']"
 주말  먹방  친구들이랑놀기  또그분이오셨다  술꾼스타그램  취함끝판  오니기리  령표김밥  대맛조개  홍가리비  치킨  만두국  계란후라이  양장피  편육  차돌라면  딸기  대박 다양하게도먹었네,7.0,minjukim45,"['#주말', '#먹방', '#친구들이랑놀기', '#또그분이오셨다', '#술꾼스타그램', '#취함끝판', '#오니기리', '#령표김밥', '#대맛조개', '#홍가리비', '#치킨', '#만두국', '#계란후라이', '#양장피', '#편육', '#차돌라면', '#딸기', '#대박', '#다양하게도먹었네']"
치킨마용 덮밥 한달에 한번정도 시켜먹는 치킨 남은치킨으로 점심메뉴 치킨마요 덮밥 한그릇 이게 왜 맛 있는지 모르는 일인 내가 먹지 않는 음식 아이들은 좋아하는 음식 너무 맛 있어서 저녁에도 먹고 싶단다 오늘의집밥  집밥메뉴 점심메뉴  점심밥 남은음식 치킨 치킨요리 치킨덮밥  치킨마요 치킨마요덮밥  아보카도치킨덮밥  한그릇메뉴  덮밥  스크램블에그  소보로덮밥  제주살이 제주생활  제주살이중 아이들이좋아하는메뉴 잘먹는아들 맛있단다 swellkitchen  오늘도맛있게잘먹었습니다 ,15.0,swellkitchen241014,"['#오늘의집밥', '#집밥메뉴', '#점심메뉴', '#점심밥', '#남은음식', '#치킨', '#치킨요리', '#치킨덮밥', '#치킨마요', '#치킨마요덮밥', '#아보카도치킨덮밥', '#한그릇메뉴', '#덮밥', '#스크램블에그', '#소보로덮밥', '#제주살이', '#제주생활', '#제주살이중', '#아이들이좋아하는메뉴', '#잘먹는아들', '#맛있단다', '#swellkitchen', '#오늘도맛있게잘먹었습니다😋']"
이제 집에서 양념치킨 만들어 먹는 것 쯤은 기본이 되어버린  양념치킨 치킨 만두 납작만두 시애틀 시애틀맛집 홈쿡 friedchicken chilisaucechicken chicken mandu dumplings koreanfood healthfoods seattle seattlefood foodie delicious dailyfood homemade homecooking meals baekmeals,37.0,baekmeals,"['#양념치킨', '#치킨', '#만두', '#납작만두', '#시애틀', '#시애틀맛집', '#홈쿡', '#friedchicken', '#chilisaucechicken', '#chicken', '#mandu', '#dumplings', '#koreanfood', '#healthfoods', '#seattle', '#seattlefood', '#foodie', '#delicious', '#dailyfood', '#homemade', '#homecooking', '#meals', '#baekmeals']"
한쿡 일차에버랜드 눈썰매 짱짱,3.0,delay_iii,[]
 야식  치킨ㆍ야식은치킨이지ㅋㅋㅋㅋㅋㅋ신랑저녁안묵었다해서걍야식으로치킨배달ㆍ 밥상기록중  밥상  집밥  홈쿡  밥  반찬  야식  밥스타그램  먹스타그램  집밥스타그램  요리스타그램  푸드스타그램  맛스타그램 최쓰리네  최브맘  형제맘  아들둘맘  초딩중딩맘  아미의밥상  아미의레시피  아미의일상  9년차아미,14.0,bts13_84,"['#야식', '#치킨ㆍ야식은치킨이지ㅋㅋㅋㅋㅋㅋ신랑저녁안묵었다해서걍야식으로치킨배달ㆍ', '#밥상기록중🥢', '#밥상', '#집밥', '#홈쿡', '#밥', '#반찬', '#야식', '#밥스타그램', '#먹스타그램', '#집밥스타그램', '#요리스타그램', '#푸드스타그램', '#맛스타그램', '#최쓰리네', '#최브맘', '#형제맘', '#아들둘맘', '#초딩중딩맘', '#아미의밥상', '#아미의레시피', '#아미의일상', '#9년차아미']"
 돌아온 치킨 매니아 bhc,3.0,eunsunnyism,"['#돌아온', '#치킨', '#매니아', '#bhc']"
 출시했던날부터 너무 인기많는 펜킹탉   ppenking  곧 새 버전의 브랜드와 콜라보한 탉 출시예정     2023 01 KR  la    ,200.0,jason.j.oh,"['#la', '#🇺🇸']"
 강남  홍대  광주  고1  고2  고3  얼짱  얼스타그램 셀스타그램  셀피  셀카  럽스타그램  홍보  인친  팔로우  팔로워  맞팔  선팔  좋아요  일상  휴일  주말  술스타그램  신림  교대  치킨  먹스타그램  좋아요반사  openrp  wwerp,4.0,skaalstj_9522,"['#강남', '#홍대', '#광주', '#고1', '#고2', '#고3', '#얼짱', '#얼스타그램', '#셀스타그램', '#셀피', '#셀카', '#럽스타그램', '#홍보', '#인친', '#팔로우', '#팔로워', '#맞팔', '#선팔', '#좋아요', '#일상', '#휴일', '#주말', '#술스타그램', '#신림', '#교대', '#치킨', '#먹스타그램', '#좋아요반사', '#openrp', '#wwerp']"
오우 메뉴 굳 치킨 한식부페 무한리필 시청역 닭파티,6.0,parkyoungho1214,"['#메뉴', '#굳', '#치킨', '#한식부페', '#무한리필', '#시청역', '#닭파티']"
헐 치즈으으으으으  맛있겠어용  ,3.0,siall___smp,[]
 주말동안 처갓집에서 놀고 계양산 탐  저녁엔 원이네랑 만남          토요일에 원래는 시골 가기로 했었다가 눈소식에 취소함  댄스학원 갔다가 처갓집가서 자고옴 ㅋ 밥먹고 신년회로 회  치킨 등등 사다먹고 오붓한 시간을 보내고 담날 아침 먹자마자 계양산 탐  산타기를 너무너무 싫어하는 나지만  새해를 맞이 장인 장모님 모시고 아이들과 함께 출발 ㅋ 출렁다리를 갔는데 안출렁 거려서 내가 출렁거리게 만듦 ㅋㅋ 간만에 산을타니 땀도나고 ㅋ 내려오면서 황기순칼국수 가서 칼국수 먹고 임학역에서 전철타고 계산역까지 옴 ㅋ 한정거장 ㅋㅋㅋ 집에와서 좀 쉬다가 저녁엔 원이네랑 만나서 신년회함 ㅋ 우리딸 전교 부회장 된거 축하한다며 형수가  스왈로브스키  목걸이를 기념 선물로 사옴  ㅠ ㅠ 대박 감동            인삼주에 바베큐에 조개전골에 또 술 마시고 그대로 뻗어잔 어제 ㅋㅋㅋ 간만에 즐겁고 재밌었던 주말           일기  처갓집  장인  장모님  주말  계양산  출렁다리  개구쟁이  스왈로브스키  목걸이  부회장  선물  기념  고마워  감사함  고마움  대박  이웃  형  등산  치킨  아이스크림  연어회  주말스타그램,123.0,bjjaemin,"['#일기', '#처갓집', '#장인', '#장모님', '#주말', '#계양산', '#출렁다리', '#개구쟁이', '#스왈로브스키', '#목걸이', '#부회장', '#선물', '#기념', '#고마워', '#감사함', '#고마움', '#대박', '#이웃', '#형', '#등산', '#치킨', '#아이스크림', '#연어회', '#주말스타그램']"
 훌랄라치킨훌랄라치킨의 BEST 메뉴 치즈양념구이로사행시를 해보았는데요  재치있는 사행시를 댓글로 남겨주세요  달콤한 치즈양념구이 먹고치밥은 필수인거 다들 아시죠   지금 가까운 훌랄라치킨에서 만나보세요 ,47.0,hoolala_official,['#훌랄라치킨훌랄라치킨의']
